MESSAGE,RESPONSE,GOOGLE
Vì sao ngựa thường ngủ đứng? - KhoaHoc.tv,"20 Tháng Mười Hai 2019 ... Tài phi của ngựa thì ai cũng biết vì ngựa có thân hình thon dài, bốn chân vững 
chắc. Nhưng ngựa có đặc tính không giống với các loài động ...",Tại sao ngựa ngủ đứng?
Vì sao ngựa thường ngủ đứng? - VnExpress,"31 Tháng Giêng 2014 ... Hàng xóm nhà tôi có nuôi ngựa và tôi quan sát thấy loài này không bao giờ nằm 
xuống ngủ, mà hình như chúng ngủ đứng. Có ai giải thích ...",Tại sao ngựa ngủ đứng?
Tại sao ngựa ngủ đứng? - VnExpress,"6 Tháng Giêng 2013 ... Tôi nhận thấy khả năng đặc biệt của ngựa là chúng có thể đứng để ngủ. Tại sao 
loài động vật này có thể làm điều đó? - VnExpress.",Tại sao ngựa ngủ đứng?
Ngủ đứng - Tin tức mới nhất 24h qua - VnExpress,"Tại sao ngựa ngủ đứng? Tôi nhận thấy khả năng đặc biệt của ngựa là chúng có 
thể đứng để ngủ. Tại sao loài động vật này có thể làm điều đó?",Tại sao ngựa ngủ đứng?
Tốc độ chạy của ngựa là bao nhiêu? - VnExpress,"2 Tháng 2 2014 ... Có phải loài ngựa có thể chạy tốc độ gần 40 km một giờ ở cự ly ngắn không, hay 
là chúng có ... Tại sao 'đếm cừu' giúp vào giấc ngủ nhanh?",Tại sao ngựa ngủ đứng?
"Khoa học công nghệ - Tin kỹ thuật, nghiên cứu ứng dụng ...","Vì sao ngựa thường ngủ đứng? Hàng xóm nhà tôi có nuôi ngựa và tôi quan sát 
thấy loài này không bao giờ nằm xuống ngủ, mà hình như chúng ngủ đứng.",Tại sao ngựa ngủ đứng?
Vì sao chải tóc mùa đông có tiếng kêu? - VnExpress,"10 Tháng Giêng 2013 ... Vào mùa đông, mỗi lần đưa lược lên chải tóc, tôi nghe có tiếng kêu tách tách, 
còn vào mùa hè thì không? Vì sao vậy? - VnExpress.",Tại sao ngựa ngủ đứng?
Tư vấn khoa học - Trang 1 - VnExpress,"Tại sao ngựa ngủ đứng? 54. Tôi nhận thấy khả năng đặc biệt của ngựa là chúng 
có thể đứng để ngủ. Tại sao loài động vật này có thể làm điều đó?",Tại sao ngựa ngủ đứng?
Ngựa vằn trông thế nào? - VnExpress,"1 Tháng 2 2014 ... Ngựa vằn là ngựa có lông trắng sọc đen hay lông đen sọc trắng? Xin cảm ơn. ... 
Vì sao ngựa thường ngủ đứng? / Vì sao ngựa không nằm ...",Tại sao ngựa ngủ đứng?
Hệ động vật Việt Nam – Wikipedia tiếng Việt,"Chúng phân bố rộng khắp trên Việt Nam, sống trên núi, vùng đồng bằng, hải đảo
, ... Quý hiếm có chim yến ở các đảo núi đá ngoài biển cho tổ yến (yến sào) có 
giá trị ... Hệ động vật dưới nước: Có tới 2.000 loại cá với nhiều loại có giá trị kinh 
tế ... thực vật giới động vật giới Việt Nam có nhiều dạng đặc hữu, hơn 100 loài và
 ...",Tại sao chủng loại thực vật trên núi nhiều hơn so với đồng bằng?
Hổ – Wikipedia tiếng Việt,"Hổ là một loại thú dữ ăn thịt sống, chúng dễ nhận biết nhất với các sọc vằn dọc ... 
Hổ là một trong số nhiều loài động vật ăn thịt nằm ở mắt xích cuối cùng của ... Hổ 
được liệt kê là loài có nguy cơ tuyệt chủng trong Sách đỏ IUCN kể từ năm 1986. 
..... tại sao hoa văn đốm và hoa hồng là kiểu ngụy trang phổ biến hơn trong số ...",Tại sao chủng loại thực vật trên núi nhiều hơn so với đồng bằng?
Châu Nam Cực – Wikipedia tiếng Việt,"Chỉ có các vi sinh vật ưa lạnh có thể sống sót ở châu Nam Cực như các loại tảo, 
... ""cân bằng"" với nhiều lục địa ở phía bắc của châu Âu, Á và Bắc Mỹ - đã tồn tại 
từ thời ... Cực"", các nhà địa lý tin rằng lục địa này phải lớn hơn kích thước thực 
của nó. .... Mặc dù rất lạnh, châu Nam Cực cũng đã từng có núi lửa hoạt động.",Tại sao chủng loại thực vật trên núi nhiều hơn so với đồng bằng?
Vườn quốc gia Phong Nha - Kẻ Bàng – Wikipedia tiếng Việt,"Phong Nha-Kẻ Bàng nằm ở một khu vực núi đá vôi rộng khoảng 200.000 ha 
thuộc ... Các hang động ở đây có tổng chiều dài khoảng hơn 80 km nhưng các 
nhà ..... So với các khu vực carxtơ khác trên thế giới đã được công nhận là di sản 
thế ..... của vùng sinh thái Trường Sơn. Cho đến nay, chủng loại thực vật lớn nhất 
ở ...",Tại sao chủng loại thực vật trên núi nhiều hơn so với đồng bằng?
Đà Lạt – Wikipedia tiếng Việt,"Đà Lạt là thành phố tỉnh lỵ của tỉnh Lâm Đồng, nằm trên cao nguyên Lâm Viên, ... 
Đà Lạt ngày nay là một thành phố đông dân, đô thị loại I trực thuộc tỉnh, giữ vai 
trò ..... Do nằm ở độ cao 1.500 mét và được các dãy núi cùng quần hệ thực vật 
rừng, đặc ... So với vùng đồng bằng, Đà Lạt có số ngày mưa trong năm nhiều 
hơn, ...",Tại sao chủng loại thực vật trên núi nhiều hơn so với đồng bằng?
Đức – Wikipedia tiếng Việt,"Đức có lịch sử văn hóa phong phú, liên tục sản sinh nhiều nhân vật có ảnh ... Alb 
gần Ulm. Trong những vật được tìm thấy có các sáo bằng xương chim và ngà voi 
..... trung và hành quyết trên khắp châu Âu để tiến hành diệt chủng những người 
..... Hoạt động núi lửa không được quan sát thấy tại Đức. Tuy vậy, trong một số ...",Tại sao chủng loại thực vật trên núi nhiều hơn so với đồng bằng?
Hoang mạc – Wikipedia tiếng Việt,"Sa mạc Sahara là một hoang mạc lớn nhất trên thế giới, nó chiếm hơn 30% diện 
tích .... Nhiều giả thuyết khác nhau đã được đưa ra nhằm giải thích lý do tại sao ... 
nên các vùng núi có độ cao đến 6.885 m (22.589 ft) hoàn toàn bị đóng băng và ở 
... Tuy nhiên, có một số thực vật sống ở Atacama, chúng đặc biệt thích nghi khi ...",Tại sao chủng loại thực vật trên núi nhiều hơn so với đồng bằng?
Trái Đất – Wikipedia tiếng Việt,"Trục tự quay của Trái Đất nghiêng một góc bằng 23,44° so với trục vuông góc ... 
và các tiền hành tinh lớn hơn, các sao chổi, và các vật thể ở xa hơn Sao Hải .... 
khiến cho các loại động vật trên Trái Đất sẽ bị tuyệt chủng hoàn toàn trong ... kính 
tại đường xích đạo dài hơn 43 km so với độ dài đường kính tính từ cực tới cực.",Tại sao chủng loại thực vật trên núi nhiều hơn so với đồng bằng?
Địa lý Nhật Bản – Wikipedia tiếng Việt,"Các đảo Nhật Bản là một phần của dải núi ngầm trải dài từ Đông Nam Á tới 
Alaska. Nhật Bản có bờ biển dài 37.000 km, có đá lớn và nhiều vịnh nhỏ nhưng 
rất tốt và ... có một số đỉnh núi cao trên 3000 mét, hơn 532 ngọn núi cao hơn 
2000 mét. ... trên thực tế ở các vùng biển Nhật Bản và biển Đông Hải thì phạm vi 
hẹp hơn ...",Tại sao chủng loại thực vật trên núi nhiều hơn so với đồng bằng?
Sư tử – Wikipedia tiếng Việt,"Sư tử có tập tính xã hội khác biệt so với các loài họ Mèo còn lại với lối sống theo 
bầy đàn. .... trong khi các mẫu từ Đông và Nam Phi cho thấy nhiều đột biến hỗ trợ 
nhóm này ... Hơn 190 mẫu sư tử đã có sẵn cho nghiên cứu thực vật học, bao 
gồm tám .... Hóa thạch sớm nhất có thể nhận ra là sư tử được tìm thấy tại Hẻm 
núi ...",Tại sao chủng loại thực vật trên núi nhiều hơn so với đồng bằng?
Vì sao lá trên ngọn rụng cuối cùng? - VnExpress,"31 Tháng Mười 2001 ... Rụng lá cũng vậy, rụng ở dưới trước, càng lên trên ngọn, lá càng rụng ... cây thay 
màu lá từ xanh sang vàng, cuối cùng trút nốt chiếc áo này, ...",Vì sao lá trên ngọn rụng cuối cùng?
Vì sao lá cây đổi màu? - VnExpress,"17 Tháng Mười 2007 ... Tại sao một số cây có lá nhọn? / Vì sao lá trên ngọn rụng cuối cùng? ... Nếu bạn 
thấy lá cây chuyển màu đỏ sớm, vào cuối tháng 8, có thể cây ...",Vì sao lá trên ngọn rụng cuối cùng?
Chuyện lạ trên thế giới - Những câu chuyện khó tin - VnExpress ...,"19 Tháng Mười Một 2019 ... Đó là chưa kể tới việc nó tự quay quanh mình với tốc độ ở đường xích đạo là 465 
mét/giây. ... Vì sao lá trên ngọn rụng cuối cùng? Vì sao lá trên ...",Vì sao lá trên ngọn rụng cuối cùng?
Động thực vật - Trang 4 - VnExpress,"Vì sao lá trên ngọn rụng cuối cùng? Ở miền ôn đới, mỗi khi mùa thu đến, cây 
thay màu lá từ xanh sang vàng, cuối cùng trút nốt chiếc áo này, trần trụi đón mùa
 ...",Vì sao lá trên ngọn rụng cuối cùng?
"Vì sao cây ôn đới rụng lá mùa thu, cây nhiệt đới rụng vào đông ...","11 Tháng Chín 2001 ... Lá rụng vì cây không thể cung cấp nước cho nó. ... Cuối cùng, do lượng nước ít, 
mạch dẫn trong cuống lá không vận chuyển nước đến nữa, lá ...",Vì sao lá trên ngọn rụng cuối cùng?
Ragnarök – Wikipedia tiếng Việt,"Ragnarök (""Hoàng hôn của chư thần"" hay ""tận thế"") là chương cuối cùng .... cưỡi 
trên lưng con chiến mã Sleipnir, mình mặc bộ giáp vàng chói, tay vung ngọn giáo 
... Các vì sao rơi rụng lả tả, mặt đất chìm xuống đáy đại dương, Yggdrasil quằn ...",Vì sao lá trên ngọn rụng cuối cùng?
rụng lá - KhoaHoc.tv,"rụng lá. Bí ẩn trong tượng gỗ nhiều tuổi gấp đôi Kim tự tháp. Bức tượng Shigir 
gần 10.000 năm tuổi ở Nga được xem là ... Vì sao lá trên ngọn rụng cuối cùng?",Vì sao lá trên ngọn rụng cuối cùng?
Hoa Kỳ – Wikipedia tiếng Việt,"Hoa Kỳ là một trong những quốc gia đa dạng chủng tộc nhất trên thế giới, do kết 
..... hơn về phía bên trong đất liền cho các khu rừng dễ rụng lá theo mùa và các 
ngọn ..... Hawaii là bang thứ 50 của Mỹ và là bang cuối cùng mà Mỹ chiếm được 
vào ...... Thừa kế tài sản có thể lý giải tại sao nhiều người Mỹ trở nên giàu có vì có
 ...",Vì sao lá trên ngọn rụng cuối cùng?
Khoa học - Chuyện lạ - Trang 99,"4 Tháng Sáu 2019 ... Vì sao lá trên ngọn rụng cuối cùng? Ở miền ôn đới, mỗi khi mùa thu đến, cây 
thay màu lá từ xanh sang vàng, cuối cùng trút nốt chiếc áo này, ...",Vì sao lá trên ngọn rụng cuối cùng?
10 Vạn Câu Hỏi Vì Sao - Phần 7,"Đọc truyện 10 Vạn Câu Hỏi Vì Sao - Phần 7 online, liên tục cập nhật tập mới. ... 
Vì sao lá trên ngọn rụng cuối cùng? Ở miền ôn đới, mỗi khi mùa thu đến, cây ...",Vì sao lá trên ngọn rụng cuối cùng?
Vì sao cá thích bơi ngược dòng? - VnExpress,"14 Tháng Ba 2005 ... Khi bơi xuôi theo dòng nước để kiếm mồi, cá phải tốn rất nhiều sức lực để đuổi 
theo con mồi, còn bơi ngược dòng thì lại khác, chỉ cần há ...",tại sao cá bơi ngược dòng?
Tại sao cá bơi ngược dòng nước? - VnExpress,"17 Tháng 2 2013 ... Khi đi câu, tôi thấy rất nhiều con cá bơi ngược dòng nước. Tại sao cá không bơi 
xuôi dòng chảy? - VnExpress.",tại sao cá bơi ngược dòng?
Cá hồi di cư – Wikipedia tiếng Việt,"Tuy nhiên, có nhiều con thuộc nhiều loài sống cả đời tại vùng nước ngọt. Hầu 
hết cá hồi tuân theo mô hình cá di cư bơi ngược dòng sông để sinh sản, giai 
đoạn ...",tại sao cá bơi ngược dòng?
Cá chép không vảy bơi ngược dòng để đẻ trứng ở hồ Thanh Hải,"8 Tháng Bảy 2019 ... Cá chép trần, loài cá chép không vảy trong sách đỏ của Trung Quốc, bắt đầu 
hành trình di cư hàng ... Cá chép không vảy bơi ngược dòng để đẻ trứng ở hồ 
Thanh Hải .... Tại sao cách này dẫn người ta vào giấc ngủ nhanh?",tại sao cá bơi ngược dòng?
"Phúc báo đời người: Cá lội ngược dòng cá mới sống, người vượt ...","5 Tháng Năm 2019 ... Phúc báo đời người: Cá lội ngược dòng cá mới sống, người vượt ... đang là một 
chú cá rẽ dòng nước ngược dòng để bơi về phía trước. ... Nhưng không vất vả thì 
sao thành tài, chỉ có vất vả mới thực sự là con đường tiến lên.",tại sao cá bơi ngược dòng?
"Hành trình ""tìm về cái chết"" của cá hồi và 2 bài học làm người cần ...","16 Tháng Mười Hai 2016 ... Cá hồi là loài cá tìm về cội nguồn vào cuối đời, chúng chết tại chính nơi ... chúng 
phải bơi ngược dòng sông để lên thượng nguồn, đây rõ ràng là việc ... Nhưng tại 
sao chúng lại phải khổ nhọc như vậy?, hơn nữa có rất nhiều ...",tại sao cá bơi ngược dòng?
"Vì sao cá hồi ""liều mạng"" vượt sông, băng qua cả đường phố ở ...","7 Tháng Mười Một 2018 ... Vì sao cá hồi ""liều mạng"" vượt sông, băng qua cả đường phố ở Washington? 
Nguyễn ... Cá hồi bơi ngược dòng sông khi vào mùa sinh sản.",tại sao cá bơi ngược dòng?
Huka - thác nước chảy xiết khiến cá không thể bơi ngược dòng,"12 Tháng Tám 2019 ... Huka - thác nước chảy xiết khiến cá không thể bơi ngược dòng. Thác Huka được 
ví như ... Ông Nguyễn Thành Tài sai phạm vì 'tình cảm riêng' ...",tại sao cá bơi ngược dòng?
"Loài cá bơi ngược, sinh tồn 35 triệu năm dưới lòng sông - Nhịp ...","20 Tháng 4 2018 ... Bằng cách di chuyển đặc biệt này, loài cá trê nghịch đảo đã tồn tại suốt hơn 35 
triệu năm qua. ... Loài cá bơi ngược, sinh tồn 35 triệu năm dưới lòng sông. Zalo 
..... 02:10 Vi sao van chua xoa bo duoc tin dung den? hinh anh ...",tại sao cá bơi ngược dòng?
Koinobori – Wikipedia tiếng Việt,"Nhưng khung cảnh khắp nơi tại Nhật Bản đầy hình ảnh những koinobori trên 
bầu trời từ ... Hình ảnh koinobori treo đứng trên sào ở trước nhà những người 
dân tượng trưng cho hình ảnh ""cá vượt vũ môn"", bơi ngược dòng thác, được cho 
là ...",tại sao cá bơi ngược dòng?
Tại sao bầu trời có màu xanh? - KhoaHoc.tv,"6 Tháng Chín 2017 ... Ai cũng biết bầu trời có màu xanh, nhưng không phải mọi người đều biết vì sao 
bầu trời lại có màu xanh. Tại sao bầu trời thường có màu xanh ...",Tại sao bầu trời lại có màu xanh?
Băng xanh – Wikipedia tiếng Việt,"Màu xanh đôi khi bị gán sai cho tán xạ Rayleigh, chịu trách nhiệm cho màu của 
bầu trời. ... Đây là lý do chính tại sao đại dương có màu xanh. ... Đó là, bất kỳ hạt 
tuyết nào rơi trong khu vực đó được chống lại bởi sự thăng hoa hoặc tổn thất ...",Tại sao bầu trời lại có màu xanh?
Giờ xanh – Wikipedia tiếng Việt,"Giờ xanh xảy ra khi Mặt Trời đủ xa phía dưới đường chân trời để các bước sóng 
... sóng dài hơn, đỏ hơn để giải thích tại sao màu sắc của giờ này lại quá xanh. ... 
Khi bầu trời trong xanh, giờ xanh có thể là một cảnh tượng đầy màu sắc, với ...",Tại sao bầu trời lại có màu xanh?
"Vì sao bầu trời lúc xanh, lúc hồng? - VnExpress","3 Tháng Mười Một 2013 ... Khi thời tiết bình thường, tức là ít mây và nhiều nắng, bầu trời sẽ có màu xanh. 
Tuy nhiên, lúc bình minh hoặc hoàng hôn, nó lại có màu hồng.",Tại sao bầu trời lại có màu xanh?
Tại sao bầu trời màu xanh? - VnExpress,"9 Tháng Bảy 2007 ... Ánh sáng phát ra từ mặt trời bao gồm nhiều màu sắc, mỗi màu lại có một sóng 
ánh sáng khác nhau. - VnExpress.",Tại sao bầu trời lại có màu xanh?
Nhiệt độ màu – Wikipedia tiếng Việt,"1 Tại sao trời nhiều mây lại có nhiệt độ màu cao hơn trời nắng? ... Thông thường 
khi bầu trời trong thì ánh sáng được tán xạ có màu xanh ứng với nhiệt độ phát ...",Tại sao bầu trời lại có màu xanh?
Mặt Trời – Wikipedia tiếng Việt,"Mặt Trời là một ngôi sao thuộc dãy chính màu vàng chiếm khoảng 99% tổng khối 
..... Trời và tạo ra các vết đen Mặt Trời và các tai lửa Mặt Trời (xem sự nối lại từ 
trường). .... Tuy nhiên, người ta tin rằng toàn bộ Mặt Trời có cùng thành phần như 
nhau trong khi bầu khí quyển của Mặt Trời vẫn ...... Vì sao bầu trời có màu xanh?",Tại sao bầu trời lại có màu xanh?
Vì sao bầu trời màu xanh? - VnExpress,"14 Tháng Tám 2015 ... Vì sao bầu trời ban ngày khi không có mây lại mang màu xanh mà không phải 
màu tím hay một màu nào ... Mời độc giả đặt câu hỏi tại đây.",Tại sao bầu trời lại có màu xanh?
Tán xạ Rayleigh – Wikipedia tiếng Việt,"Bầu trời trên Trái Đất có màu xanh da trời là do tán xạ Rayleigh của khí ... khi Mặt 
Trời ở gần đường chân trời, vẫn là tán xạ này, lại đem lại sắc đỏ cho bầu trời, ...",Tại sao bầu trời lại có màu xanh?
Cực quang – Wikipedia tiếng Việt,"Phần lớn các cực quang có màu vàng ánh lục nhưng đôi khi các tia cao sẽ có ... 
Việc chụp ảnh cực quang đòi hỏi các máy ảnh phải được trang bị sao cho của ... 
Tại hai cực các đường cảm ứng từ hội tụ lại và làm cho các hạt mang điện theo 
đó ... nhau do đó tạo ra nhiều dải sáng với nhiều màu sắc trên bầu trời ở hai cực.",Tại sao bầu trời lại có màu xanh?
Trái đất của chúng ta bao nhiêu tuổi ?,"19 Tháng Sáu 2015 ... Trái Đất là hành tinh duy nhất trong hệ mặt trời có sự sống sinh sôi phát triển 
trong suốt hàng chục triệu năm qua. Vậy đã bao giờ bạn tự hỏi ...",Trái đất của chúng ta bao nhiêu tuổi?
Tuổi của Trái Đất – Wikipedia tiếng Việt,"Năm 1779, Comte du Buffon đã đưa ra tuổi của Trái Đất sử dụng một thí nghiệm: 
ông tạo ra một địa cầu nhỏ .... Hành tinh của chúng ta đã được 4,5 tỉ năm tuổi.",Trái đất của chúng ta bao nhiêu tuổi?
Trái Đất – Wikipedia tiếng Việt,"Tuy nhiên, người ta có chứng cứ xác định nguồn nước có ở Sao Hỏa trong quá 
khứ, và ... Lõi của Trái Đất vẫn hoạt động được bao bọc bởi lớp manti rắn dày, 
lớp lõi ngoài ... Văn hóa loài người đã phát triển tạo nên nhiều cách nhìn về Trái 
Đất bao gồm việc ..... Bên cạnh đó, lớp vỏ lục địa già nhất khoảng 4030 triệu tuổi.",Trái đất của chúng ta bao nhiêu tuổi?
Ngân Hà – Wikipedia tiếng Việt,"Hệ Mặt Trời của chúng ta di chuyển với tốc độ 220 km/s, nhưng dù với vận tốc ... 
Từ Trái Đất, dải Ngân Hà trông như một dải trắng bạc mờ ảo vắt ngang bầu trời, 
hay ... Có nhiều cách để xác định tuổi của các vật thể thiên văn, một trong số đó 
là so ... Các tua nhỏ bao quanh nó cũng có thể xem như một phần của Ngân Hà,
 ...",Trái đất của chúng ta bao nhiêu tuổi?
Mặt Trời – Wikipedia tiếng Việt,"Khoảng cách trung bình giữa Mặt Trời và Trái Đất xấp xỉ 149,6 triệu kilômét (1 
Đơn vị ... Bởi Ngân Hà của chúng ta đang di chuyển so với Màn bức xạ vi sóng 
vũ trụ .... Các photon (tia gamma) nhiều năng lượng phát ra trong các phản ứng 
tổng .... chung là hoạt động của Mặt Trời bao gồm vết đen trên bề mặt của Mặt 
Trời, ...",Trái đất của chúng ta bao nhiêu tuổi?
Mặt Trăng – Wikipedia tiếng Việt,"Khoảng cách trung bình tính từ tâm Trái Đất đến Mặt Trăng là 384.403 km, lớn .... 
Các biến đổi nhỏ (đu đưa - libration) trong góc quan sát cho phép chúng ta có ... 
chất có thể được sử dụng để ước tính tuổi của bề mặt (xem Đếm hố va chạm). ..... 
quan kích thước của Tiền Trái Đất và Theia và bao nhiêu vật liệu từ hai thiên ...",Trái đất của chúng ta bao nhiêu tuổi?
Hệ Mặt Trời – Wikipedia tiếng Việt,"Tuổi, 4,568 tỷ năm .... Những định luật của Kepler về chuyển động thiên thể miêu 
tả quỹ đạo của các vật thể quay quanh Mặt Trời. ... Chúng có thể tìm thấy dưới 
dạng băng, chất lỏng, hay khí trong nhiều nơi thuộc hệ Mặt Trời, trong khi trong ... 
Từ trường Trái Đất bảo vệ bầu khí quyển của nó không bị gió Mặt Trời tước đi.",Trái đất của chúng ta bao nhiêu tuổi?
Lịch sử Trái Đất – Wikipedia tiếng Việt,"Khí quyển ban đầu của Trái Đất có thể gồm những vật liệu bao quanh bên ..... 
Mỗi vực lại liên tiếp chia thành nhiều giống, dù chúng ta còn biết rất ít về lịch sử ...",Trái đất của chúng ta bao nhiêu tuổi?
Sao – Wikipedia tiếng Việt,"Ngôi sao gần Trái Đất nhất là Mặt Trời, nó là nguồn của hầu hết năng lượng trên 
Trái ... độ tuổi, thành phần hóa học và nhiều tính chất khác của ngôi sao bằng 
cách ... sử tiến hóa của nó, bao gồm đường kính, sự tự quay, chuyển động và 
nhiệt độ. ..... Trong Siêu đám Địa Phương chúng ta có thể nhìn thấy các quần tụ 
sao, ...",Trái đất của chúng ta bao nhiêu tuổi?
Vũ trụ – Wikipedia tiếng Việt,"Vũ trụ bao gồm các hành tinh, sao, thiên hà, các thành phần của không gian liên 
sao, ... biết được kích thước toàn thể của Vũ trụ là bao nhiêu và có thể là vô hạn. 
... ra rằng thiên hà của chúng ta chỉ là một trong số hàng trăm tỷ thiên hà khác. ..... 
bao gồm vị trí hiện tại từ Trái Đất cho tới biên giới của Vũ trụ quan sát được là ...",Trái đất của chúng ta bao nhiêu tuổi?
Mặt Trời – Wikipedia tiếng Việt,"Trong 50 hệ sao gần nhất bên trong 17 năm ánh sáng từ Trái Đất, Mặt Trời xếp 
hạng ..... ứng với bất kỳ một nguyên tố hoá học nào từng biết trên Trái Đất khi ấy. 
..... chu kỳ mặt trời dường như đã ngưng hoàn toàn trong vài thập kỷ; có rất ít vết
 ...",Mặt trời có khi nào ngừng chiếu sáng?
Trái Đất sẽ ra sao nếu Mặt Trời ngừng chiếu sáng? - VnExpress,"5 Tháng Sáu 2018 ... Vật phát cháy đến một lúc nào đó sẽ tắt, tôi nghĩ Mặt Trời cũng thế. Khi đó Trái ... 
Những chính sách nổi bật có hiệu lực từ tháng 1. Quan tâm.",Mặt trời có khi nào ngừng chiếu sáng?
Tốc độ ánh sáng – Wikipedia tiếng Việt,"Có những chuyển động siêu sáng khi quan sát các thiên thể trên bầu trời, như ... 
giới gọi là mặt cầu Hubble, vận tốc của các thiên hà sẽ vượt tốc độ ánh sáng khi 
.... Trong vật liệu khác như ngưng tụ Bose–Einstein gần độ không tuyệt đối, tốc 
độ ... ra rất nhanh khiến cho không tín hiệu nào có thể gửi nhanh hơn ánh sáng.",Mặt trời có khi nào ngừng chiếu sáng?
Sao – Wikipedia tiếng Việt,"Ngôi sao gần Trái Đất nhất là Mặt Trời, nó là nguồn của hầu hết năng lượng trên 
Trái ... trên bầu trời đêm, khi chúng không bị lu mờ đi dưới ánh sáng của Mặt Trời
. ... Trong phần lớn thời gian hoạt động của nó, một sao chiếu sáng được là do 
..... tỷ năm), cho nên chưa thể có một sao lùn đỏ nào đạt đến trạng thái như thế.",Mặt trời có khi nào ngừng chiếu sáng?
Năng lượng Mặt Trời – Wikipedia tiếng Việt,"Khi không khí đạt đến một độ cao, nơi nhiệt độ thấp, hơi nước ngưng tụ thành ... 
Đèn năng lượng mặt trời có tính phí trong ngày và ánh sáng vào lúc hoàng hôn 
..... gia đình một tín dụng cho bất kỳ điện năng nào mà họ cung cấp cho lưới điện.",Mặt trời có khi nào ngừng chiếu sáng?
