MESSAGE,RESPONSE,GOOGLE
Lịch sử Hoa Kỳ – Wikipedia tiếng Việt,"Trong thời đại tái thiết (1863–1877), Hoa Kỳ chấm dứt chủ nghĩa nô lệ và nới 
rộng .... Những cư dân đầu tiên này, được gọi là người ""Paleoamericans"", chẳng 
bao ... Sau một thời kỳ thám hiểm được các quốc gia lớn ở châu Âu bảo trợ, các 
.... từ các thuộc địa Anh ở vùng Tây Ấn. Đến khoảng thập niên 1770, họ chiếm 
một ...","Trong thời kỳ chiếm hữu nô lệ, ở các quốc gia phương Tây, chủ nô gọi nô lệ là gì?"
Hoa Kỳ – Wikipedia tiếng Việt,"Tên Columbia cũng có một thời là tên thông dụng để chỉ châu Mỹ và Hoa Kỳ. Nó 
... Tại Trung Quốc, Hoa Kỳ chưa bao giờ là tên gọi quan phương của nước Mỹ. 
.... lốc xoáy của thế giới xảy ra trong Hoa Kỳ lục địa, chủ yếu là miền Trung Tây. 
..... sự chiếm hữu nô lệ và các tiểu bang có chế độ nô lệ ngày một gia tăng trong
 ...","Trong thời kỳ chiếm hữu nô lệ, ở các quốc gia phương Tây, chủ nô gọi nô lệ là gì?"
Chủ nghĩa thực dân – Wikipedia tiếng Việt,"Tuy nhiên, sự thật về chủ nghĩa thực dân thường là sự nô dịch, chiếm đất hoặc 
cái ... nhưng việc các cường quốc phương Tây can thiệp vào nội bộ nước nhỏ 
vẫn ... Tuy nhiên, cũng có dân nhập cư thuộc thành phần khác - những nô lệ để 
... hóa trong thế kỷ 19 dẫn đến một thời kỳ được gọi là Tân chủ nghĩa đế quốc, 
khi tốc ...","Trong thời kỳ chiếm hữu nô lệ, ở các quốc gia phương Tây, chủ nô gọi nô lệ là gì?"
Động vật lớn – Wikipedia tiếng Việt,"Nhiều loài động vật khổng lồ được coi là loài có kích thước to lớn nhất trong họ ... 
Cá voi xanh được xem là động vật lớn nhất trên thế giới sống trong đại dương. ... 
có thể thấy bất kỳ động vật có vú nào, những con đực thường nặng hơn so với ...",Loài động vật nào lớn nhất trên thế giới?
10 động vật lớn nhất từ xưa đến nay trên trái đất - Thế giới - ZING.VN,"30 Tháng Tám 2014 ... Bên cạnh các loài bò sát có kích thước khổng lồ đã tuyệt chủng, cá voi xanh là 
loài động vật lớn nhất thế giới còn tồn tại trên trái đất cho đến ...",Loài động vật nào lớn nhất trên thế giới?
Cá nhà táng – Wikipedia tiếng Việt,"Nó là loài động vật có răng lớn nhất trên thế giới. .... gì đến kích thước cá nhà 
táng đực và trên thực tế kích thước của chúng đáng ra phải tăng lên .... Tuy nhiên
, hiện này hầu như không có bất kỳ ghi chép nào về các cuộc tỉ thí như thế này cả
.",Loài động vật nào lớn nhất trên thế giới?
Hổ – Wikipedia tiếng Việt,"Hổ là động vật to lớn nhất trong họ Mèo và là động vật lớn thứ 3 trong các loài 
thú ăn thịt ... những loài động vật có biểu tượng lôi cuốn và dễ nhận biết nhất trên 
thế giới. ..... Không có một con hổ Bali nào còn sống trong tình trạng nuôi nhốt.",Loài động vật nào lớn nhất trên thế giới?
Voi – Wikipedia tiếng Việt,"Họ Voi hiện có ba loài còn tồn tại là: voi đồng cỏ châu Phi và voi rừng châu Phi (
có thể ... Voi là động vật có vú lớn nhất còn sinh sống trên mặt đất ngày nay. ... 
vật được bảo vệ, và việc nuôi nhốt như là động vật cảnh bị cấm trên toàn thế giới
. .... sóc cho nhau, thậm chí sẵn sàng cho bất kỳ chú voi con nào bú nếu cần thiết.",Loài động vật nào lớn nhất trên thế giới?
Động vật lưỡng cư – Wikipedia tiếng Việt,"Các động vật lưỡng cư nhỏ nhất (và có xương sống) trên thế giới là loài ếch ở ... 
Các động vật lưỡng cư còn tồn tại lớn nhất là kỳ giông khổng lồ Trung Quốc ... 
Không có động vật bốn chân nào khác trên đất liền và các động vật lưỡng cư 
nằm ...",Loài động vật nào lớn nhất trên thế giới?
Châu Nam Cực – Wikipedia tiếng Việt,"Châu Nam Cực được xem là 1 hoang mạc có diện tích lớn nhất thế giới, với ... vi 
khuẩn, nấm, ký sinh trùng, và một số loài động vật nhất định như mạt, giun tròn, 
chim ... không có dấu hiệu nào cho thấy con người đã đến đây cho đến thế kỷ 
XIX. .... Châu Nam Cực là lục địa lạnh nhất trên Trái Đất. Nhiệt độ tự nhiên thấp 
nhất ...",Loài động vật nào lớn nhất trên thế giới?
Người – Wikipedia tiếng Việt,"Trong giới tự nhiên, con người là loài duy nhất có thể tạo ra lửa, nấu thức ăn, ... 
Màu da của con người phần lớn là do các điều kiện địa lý xác định, và có sự liên 
... Cũng giống như các động vật sinh sản hữu tính khác, thế hệ mới hình thành từ 
sự ..... Ngày nay, hầu hết bất cứ nơi nào trên thế giới người ta không chỉ có thể ...",Loài động vật nào lớn nhất trên thế giới?
Rừng mưa Amazon – Wikipedia tiếng Việt,"... một dải rừng mưa nhiệt đới lớn nhất và phong phú nhất về loài cây, động vật 
trên thế giới. Rừng mưa Amazon là một khu bảo tồn thiên nhiên trên thế giới.",Loài động vật nào lớn nhất trên thế giới?
Vườn quốc gia Yellowstone – Wikipedia tiếng Việt,"Yellowstone nổi tiếng với các loài động vật hoang dã và các điểm địa nhiệt, .... 
Vườn quốc gia Yellowstone có một trong những rừng hóa đá lớn nhất trên thế 
giới, .... Vườn quốc gia chứa mạch nước phun hoạt động lớn nhất thế giới—
Mạch ...",Loài động vật nào lớn nhất trên thế giới?
Thung lũng Silicon – Wikipedia tiếng Việt,"Thung lũng Silicon (tiếng Anh: Silicon Valley; còn được gọi Thung lũng Điện tử) 
là phần phía Nam của vùng vịnh San Francisco tại phía Bắc California ở Mỹ.",Thung lũng Silicon là gì?
"Trước khi Facebook, Apple đến, Thung lũng Silicon trông như thế ...","30 Tháng Chín 2019 ... Trước những năm 1960 khi chưa có Apple hay Tesla, Thung lũng Silicon đã là 
nơi đóng quân của hàng chục công ty sản xuất bóng bán dẫn ...",Thung lũng Silicon là gì?
Những mảng màu tối ở Thung lũng Silicon - Công nghệ - ZING.VN,"15 Tháng Giêng 2016 ... Thung lũng Silicon luôn là mơ ước của nhiều người. ... Vậy, những biểu hiện này 
nói lên điều gì? Lý do nào tạo nên dòng chảy thoát ly khỏi ...",Thung lũng Silicon là gì?
Cuộc sống thiếu thốn ờ Thung lũng Silicon,"3 Tháng 2 2019 ... Cuộc sống bằng đồng lương kỹ sư IT ở Thung lũng Silicon ... Tuy nhiên, thực tế 
là họ phải trích phần lớn lương cho tiền thuê nhà, và chỉ còn lại ...",Thung lũng Silicon là gì?
Nhân viên ở Thung lũng Silicon ăn gì? - Công nghệ - ZING.VN,"5 Tháng Tám 2018 ... Những món ăn miễn phí là đặc quyền mà các công ty công nghệ dành cho nhân 
viên của ... Nhan vien o Thung lung Silicon an gi? hinh anh 1.",Thung lũng Silicon là gì?
'Sao Việt Nam phải tạo ra một Thung lũng Silicon nữa?' - Thế giới ...,"17 Tháng Mười Một 2019 ... 'Sao Viet Nam phai tao ra mot Thung lung Silicon nua? .... Và, quan trọng hơn cả 
chuyện vốn là chuyện điều gì sẽ xảy ra nếu bạn có đến 500 ...",Thung lũng Silicon là gì?
Startup Việt gọi vốn tại thung lũng Silicon như thế nào? - Công nghệ ...,"2 Tháng Năm 2016 ... Để được nhận vào một ""vườn ươm"" startup tại thung lũng Silicon là chuyện 
không đơn giản. Một startup Việt đã làm được điều đó và đang ...",Thung lũng Silicon là gì?
"San Jose, California – Wikipedia tiếng Việt","Trong thập niên 70, việc xây dựng Thung lũng Silicon tại đây khiến cho San Jose 
– nằm trong trung tâm Thung lũng Silicon được đặt nickname là Thủ đô Thung ...",Thung lũng Silicon là gì?
Bên trong thung lũng Silicon của Trung Quốc: từ đạo nhái đến đổi mới,"29 Tháng Mười Một 2018 ... Makeblock là một trong những startup nổi bật tại ""thung lũng Silicon của ... 10 
năm trước, 90% những gì hiện diện ở Thâm Quyến là đạo nhái, ...",Thung lũng Silicon là gì?
Đại học Stanford – Wikipedia tiếng Việt,"Stanford được biết đến với sức mạnh học tập, sự giàu có, gần gũi với Thung lũng 
Silicon và được xếp hạng là một trong những trường đại học hàng đầu thế ...",Thung lũng Silicon là gì?
Đền Ngọc Sơn – Wikipedia tiếng Việt,"Tọa độ, 21°02′B 105°51′Đ﻿ / ﻿21,03°B 105,85°Đ﻿ / 21.03; 105.85 ... Đền Ngọc 
Sơn là một ngôi đền thờ nằm trên đảo Ngọc của hồ Hoàn Kiếm ở Hà Nội, Việt 
Nam. ... Lúc đầu được gọi là chùa Ngọc Sơn (chữ Nho: 玉山), sau đổi gọi là đền 
Ngọc Sơn vì trong .... Tuyển tập văn bia Hà Nội, quyển 2, Khoa Học Xã hội, 1978, 
tr.",Đền Ngọc Sơn tọa lạc ở đâu?
Hồ Hoàn Kiếm – Wikipedia tiếng Việt,"Tên hồ còn được lấy để đặt cho một quận trung tâm của Hà Nội (quận Hoàn 
Kiếm) và .... Nơi đây từng là nơi chôn cất của vợ một tướng Pháp; Đền Ngọc Sơn
: nằm ở phía Bắc hồ, xưa có tên là Tượng Nhĩ (tai voi). ... Toạ lạc theo hướng 
Nam.",Đền Ngọc Sơn tọa lạc ở đâu?
Chùa Bộc – Wikipedia tiếng Việt,"Chùa Bộc còn có tên chữ là Sùng Phúc Tự hay Thiên Phúc Tự), tọa lạc tại xã 
Khương Thượng, nay thuộc phường Quang Trung, quận Đống Đa, thành phố Hà 
Nội. ... Ở chùa có cơ sở chữa bệnh bằng thuốc Nam nổi tiếng. ... Văn hóa công 
nhận là Di tích lịch sử - văn hóa quốc gia từ năm 1962 (cùng đợt với đền Ngọc 
Sơn,.",Đền Ngọc Sơn tọa lạc ở đâu?
Điện Hòn Chén – Wikipedia tiếng Việt,"Điện Hòn Chén tọa lạc trên núi Ngọc Trản, thuộc làng Ngọc Hồ, phường ... điện 
vẫn xuất hiện với tên chính thức ""Ngọc Trản Sơn Từ"" (đền thờ ở núi Ngọc Trản).",Đền Ngọc Sơn tọa lạc ở đâu?
Dinh Cô (Long Hải) – Wikipedia tiếng Việt,"... khu đền hoành tráng có lối kiến trúc cổ pha lẫn hiện đại; hiện tọa lạc bên bờ 
biển ... tích in đậm bản sắc dân tộc Việt mà chủ thể trực tiếp là ngư dân ở địa 
phương. ... đồi Cô Sơn. Từ đó cô luôn hiển linh mộng báo điềm lành, diệt trừ dịch 
bệnh, ... Chúa Ngọc Nương Nương, Chúa Tiên Nương Nương, Chư vị, Bà Mẹ 
Sanh, ...",Đền Ngọc Sơn tọa lạc ở đâu?
Đền Hùng – Wikipedia tiếng Việt,... Google Maps có thể không chính xác. Google. “Đền Hùng” (Bản đồ).,Đền Ngọc Sơn tọa lạc ở đâu?
Khu di tích chiến thắng Rạch Gầm - Xoài Mút – Wikipedia tiếng Việt,"Khu di tích chiến thắng Rạch Gầm - Xoài Mút tọa lạc tại ấp Đông, xã Kim Sơn, 
huyện ... Tướng Nguyễn Huệ liền cho thủy quân mai phục sẵn ở đoạn sông 
Rạch ...",Đền Ngọc Sơn tọa lạc ở đâu?
Ngọc Sơn (ca sĩ) – Wikipedia tiếng Việt,"Ngọc Sơn sinh ra tại Đồ Sơn, Hải Phòng, nhưng quê quán ở Quảng Nam - Ðà 
Nẵng. Cha là ... thì Ngọc Sơn trả lời: ""Tôi nói người ta làm thôi, tôi đâu có làm!"".",Đền Ngọc Sơn tọa lạc ở đâu?
Nhà hát Lớn Hà Nội – Wikipedia tiếng Việt,"Nhà hát tọa lạc trên quảng trường Cách mạng tháng Tám, vị trí đầu phố ... tiên 
được mang tên rạp Chùa Bút nằm ở khoảng đất trống trước cửa đền Ngọc Sơn,
 ...",Đền Ngọc Sơn tọa lạc ở đâu?
"Ai có công xây dựng Tháp Rùa, cầu Thê Húc ở Hà Nội? - Tư vấn ...","22 Tháng Năm 2018 ... Câu 3: Ngôi đền nổi tiếng nào sau đây tọa lạc ở Hồ Gươm? Đền Voi Phục; Đền 
Ngọc Sơn; Đền Dược Sơn; Đền Sóc Sơn. Đền Ngọc Sơn nằm ...",Đền Ngọc Sơn tọa lạc ở đâu?
Liên minh châu Âu – Wikipedia tiếng Việt,"Liên minh châu Âu hay Liên hiệp châu Âu (tiếng Anh: European Union), cũng 
được gọi là Khối Liên Âu, viết tắt là EU, là liên minh kinh tế – chính trị bao gồm 
28 ...",EU là gì?
Europi – Wikipedia tiếng Việt,"Europi (tên La tinh: Europium) là một nguyên tố hóa học với ký hiệu Eu và số 
nguyên tử bằng 63. Tên gọi của nó có nguồn gốc từ tên gọi của châu Âu trong 
một ...",EU là gì?
Việc Vương quốc Liên hiệp Anh và Bắc Ireland rời Liên minh châu ...,"Liên minh châu Âu (EU) là khối hợp tác kinh tế chính trị cấu thành từ 28 quốc gia 
ở châu Âu. Tổ chức này được thành lập sau Chiến tranh thế giới thứ hai nhằm ...",EU là gì?
Khẩu hiệu Liên minh châu Âu – Wikipedia tiếng Việt,"In varietate concordia (dịch ra tiếng Việt là: Thống nhất trong đa dạng) là khẩu 
hiệu chính thức của Liên minh châu Âu (EU), được thông qua vào năm 2000.",EU là gì?
Chủ nghĩa hoài nghi châu Âu – Wikipedia tiếng Việt,"Các quan điểm khác thường được tổ chức bởi Eurosceptics bao gồm nhận thức 
về thâm hụt dân chủ ở Liên minh châu Âu hoặc niềm tin rằng EU là quá quan ...",EU là gì?
Hiệp định Thương mại tự do EU-Canada – Wikipedia tiếng Việt,"Hiện vẫn chưa rõ liệu các quyết định của quốc hội quốc gia các nước thành viên 
EU là cần thiết. Theo quan điểm của Ủy ban châu Âu hiệp định thuộc thẩm ...",EU là gì?
Quan hệ Việt Nam - Liên minh châu Âu – Wikipedia tiếng Việt,"Quan hệ ngoại giao Liên minh châu Âu (EU)-Việt Nam được chính thức thiết lập 
... Hiện EU là nhà tài trợ song phương lớn thứ hai về ODA và là nhà cung cấp ...",EU là gì?
Quy định bảo vệ dữ liệu chung – Wikipedia tiếng Việt,"Quy định bảo vệ dữ liệu chung (GDPR) (EU) 2016/679 là quy định của luật EU 
về bảo vệ dữ liệu và quyền riêng tư cho tất cả các cá nhân trong Liên minh châu
 ...",EU là gì?
REACH – Wikipedia tiếng Việt,"REACH, viết tắt từ Registration, Evaluation, Authorisation and Restriction of 
Chemicals, là một quy định mới trong EU về hóa chất và sử dụng an toàn hóa 
chất, ...",EU là gì?
.eu – Wikipedia tiếng Việt,".eu là tên miền Internet cấp cao nhất dành cho quốc gia (ccTLD) của Liên minh 
châu Âu, và những tổ chức và công dân thuộc các nước thành viên EU, bắt đầu ...",EU là gì?
Trùng roi xanh – Wikipedia tiếng Việt,"Chi Trùng roi xanh (Euglena) là một chi sinh vật nguyên sinh đơn bào. ... Trùng 
roi sống trong nước: ao, hồ, đầm, ruộng, vũng nước mưa. ... tiết và điều chỉnh áp 
suất thẩm thấu nhờ không bào co bóp, sinh sản vô tính theo cách phân đôi. ... Ở 
nơi có ánh sáng, nhờ các hạt diệp lục mà trùng roi dinh dưỡng kiểu tự dưỡng 
như ...",Trùng roi xanh dinh dưỡng bằng cách nào?
Trùng roi – Wikipedia tiếng Việt,"Lớp Trùng roi (Flagellata) bao gồm trùng roi xanh, tập đoàn trùng roi cùng 
khoảng ... chỉnh áp suất thẩm thấu nhờ không bào co bóp, sinh sản vô tính theo 
cách phân đôi. Lớp Trùng roi có vai trò rất quan trọng trong thiên nhiên và đối với 
con người. ... Ở nơi có ánh sáng, nhờ các hạt dự trữ mà trùng roi dinh dưỡng 
kiểu tự ...",Trùng roi xanh dinh dưỡng bằng cách nào?
Động vật nguyên sinh – Wikipedia tiếng Việt,"... nguyên sinh có khả năng chuyển động và dinh dưỡng chủ yếu bằng cách dị 
dưỡng. ... loài, trong đó một số cũng có cả khả năng quang hợp như trùng roi 
xanh. ... thường nằm ở một vị trí nhất định nào đó trên cơ thể động vật nguyên 
sinh), ...",Trùng roi xanh dinh dưỡng bằng cách nào?
Tảo – Wikipedia tiếng Việt,"Tảo lục bao gồm trùng roi đơn bào và tập đoàn trùng roi (thường nhưng ... Lục 
lạp trong trùng roi xanh (Euglenoidea) và tảo lục phức tạp (Chlorarachnea) là thu 
... Điều này đã giải thích tại sao tảo đỏ có thể phân bố tới độ sâu 268 m (879 ft). ... 
Rong mơ cũng quang hợp và tự tạo ra chất dinh dưỡng (dinh dưỡng tự dưỡng).",Trùng roi xanh dinh dưỡng bằng cách nào?
Nội cộng sinh – Wikipedia tiếng Việt,"Trong phương thức này, các loài đều cộng sinh với nhau, nhưng loài nào ở ... 
mối chưa nhiễm trùng roi, thì dù được hưởng chế độ ăn uống dinh dưỡng đầy đủ
, ...",Trùng roi xanh dinh dưỡng bằng cách nào?
Trai sông – Wikipedia tiếng Việt,"Bài viết này không được chú giải bất kỳ nguồn tham khảo nào. Mời bạn giúp cải 
thiện bài viết này bằng cách bổ sung chú thích cho từng nội dung cụ thể trong bài 
viết ... Dinh dưỡng nhờ 2 đôi tấm miệng luôn luôn động. ... Ấu trùng nở ra, sống 
trong mang mẹ một thời gian rồi bám vào da mang cá một vài tuần nữa mới rơi ...",Trùng roi xanh dinh dưỡng bằng cách nào?
Phân người – Wikipedia tiếng Việt,"Xanh phổ hoặc xanh da trời, một màu được sử dụng trong điều trị hội chứng 
nhiễm ... bởi tắc mật của bất kỳ type nào (Phân trắng kết hợp với xuất huyết tiêu 
hóa (phân đen). .... Ký sinh trùng đường ruột và trứng noãn cũng tìm được tìm 
thấy. ... Tuy nhiên, đối với bệnh nhân ốm yếu và suy dinh dưỡng, tiêu chảy dẫn 
đến mất ...",Trùng roi xanh dinh dưỡng bằng cách nào?
Trùng đế giày – Wikipedia tiếng Việt,"Trùng giày được con người biết đến trước tiên trong thế giới động vật đơn ... 1 
Cấu tạo; 2 Dinh dưỡng; 3 Sinh sản; 4 Nơi sống; 5 Di chuyển; 6 Vai trò ... Sau đó 
không bào tiêu hóa rời hầu di chuyển trong cơ thể theo một quỹ đạo nhất định, 
Enzim tiêu ... Ngoài hình thức sinh sản vô tính bằng cách phân đôi theo chiều 
ngang, ...",Trùng roi xanh dinh dưỡng bằng cách nào?
Sinh vật quang dưỡng – Wikipedia tiếng Việt,"Thuật ngữ ban đầu được sử dụng với nghĩa khác, và chỉ có định nghĩa hiện tại ... 
Các sinh vật quang tự dưỡng đôi khi còn được gọi trong tiếng Anh như là ... sinh 
vật nguyên sinh (như trùng roi xanh), thực vật phù du và vi khuẩn (như ... Bạn có 
thể giúp Wikipedia bằng cách mở rộng nội dung để bài được hoàn chỉnh hơn.",Trùng roi xanh dinh dưỡng bằng cách nào?
Nấm – Wikipedia tiếng Việt,"Một số nấm có khả năng kích thích sự sinh trưởng của cây bằng cách tiết ra các 
hoóc ... Nhiều côn trùng có mối quan hệ hỗ trợ với nhiều loại nấm. ... Chúng có 
thể là nấm mốc trong nhà hay ngoài trời, đa phần là nấm sợi như các chi ... ở môi 
trường nước, đều được điều chỉnh để hút các chất dinh dưỡng hiệu quả nhất từ
 ...",Trùng roi xanh dinh dưỡng bằng cách nào?
Quốc kỳ Hoa Kỳ – Wikipedia tiếng Việt,"Quốc kỳ Hoa Kỳ (tiếng Anh: Flag of the United States of America) là lá cờ ... Ý 
nghĩa của ba màu xanh, trắng, đỏ trên lá cờ Hoa Kỳ vẫn không thay đổi ... Lá cờ 
này có 13 vạch, 7 vạch đỏ, 6 vạch trắng và ở một góc lá cờ có 13 ngôi sao trắng 
trên ...",13 vạch đỏ trên cờ Mỹ có ý nghĩa gì?
"3 màu đỏ, trắng, xanh của quốc kỳ Mỹ có ý nghĩa gì? - Du lịch - ZING ...","9 Tháng Mười 2018 ... 50 ngôi sao và 13 sọc ngang; 13 ngôi sao và 50 sọc ngang; 55 ngôi sao và 7 sọc 
... Sự cẩn trọng, sự bền chí, sự công bằng; Tất cả các ý nghĩa trên ... cờ mỹ có ý 
nghĩa gì cờ mỹ vì sao gọi mỹ là chú sam quốc kỳ mỹ có ý nghĩa ...",13 vạch đỏ trên cờ Mỹ có ý nghĩa gì?
Đại ấn Hoa Kỳ – Wikipedia tiếng Việt,"Là một huy hiệu, thiết kế có màu sắc chính thức; bản thân Đại ấn, như được ... so 
với cờ Mỹ: một là không có ngôi sao nào ở phần màu xanh bên trên (mặc dù một 
... tả là ""màu xanh lam làm màu cơ bản, được chia thành 13 vạch, trắng và đỏ"". ... 
Có hai dòng chữ ở trên và dưới: ""Annuit cœptis"", nó có nghĩa là ai đó ""nhận ra ...",13 vạch đỏ trên cờ Mỹ có ý nghĩa gì?
"3 màu đỏ, trắng, xanh của quốc kỳ Mỹ có ý nghĩa gì? - Báo Tri Thức ...","9 Tháng Mười 2018 ... Là cường quốc nổi tiếng thế giới, song có thể nước Mỹ vẫn còn nhiều điều thú vị 
có ... Ngoài ra, lá cờ này còn có 13 sọc ngang màu đỏ, trắng nằm xen kẽ nhau, 
giới hạn bởi 2 sọc đỏ ngoài cùng. ... Trong khi đó, 13 sọc đỏ, trắng lại có ý nghĩa 
gợi nhắc 13 thuộc địa Anh ở khu vực ... Tất cả các ý nghĩa trên.",13 vạch đỏ trên cờ Mỹ có ý nghĩa gì?
Quốc kỳ Việt Nam – Wikipedia tiếng Việt,"Lá cờ có hình chữ nhật, chiều rộng bằng 2/3 chiều dài, nền đỏ, ở giữa có ngôi ... 
Ý nghĩa là cờ thể hiện trong nền đỏ tượng trưng cho cách mạng, màu vàng là ... 
Quẻ Ly là 1 trong 8 quẻ của bát quái và gồm một vạch liền, một vạch đứt và một 
.... Mỹ, 1995), cho biết Việt Nam Cộng hòa sau khi thành lập đã kế thừa luôn cờ ...",13 vạch đỏ trên cờ Mỹ có ý nghĩa gì?
Chiến dịch Cờ Vàng – Wikipedia tiếng Việt,"Chiến dịch Cờ Vàng là phong trào vận động nhằm đưa cờ vàng ba sọc đỏ làm lá 
... Ngoài hình thức lá cờ, phong trào này còn mang ý nghĩa phản kháng và đối 
lập ... Trong một cuộc thăm dò ý kiến trong cộng đồng người Mỹ gốc Việt tại 
Quận ... Vì nhà trường không có cờ vàng ba sọc đỏ nên cô cùng bạn đã góp tiền 
mua ...",13 vạch đỏ trên cờ Mỹ có ý nghĩa gì?
Bạn có nhầm lẫn quốc kỳ của các nước? - Du lịch - ZING.VN,"26 Tháng Mười 2017 ... Lá cờ là niềm tự hào của mỗi quốc gia, với những màu sắc và biểu tượng ... Các 
vạch đen ở 4 góc của quốc kỳ Hàn Quốc là gì? ... Hình tròn màu đỏ trên quốc kỳ 
Nhật Bản tượng trưng cho điều gì? ... Trắc nghiệm quốc kỳ của các nước trên thế 
giới Trắc nghiệm du lịch Ý nghĩa cờ Hàn Quốc Ý nghĩa cờ Mỹ ...",13 vạch đỏ trên cờ Mỹ có ý nghĩa gì?
Lịch sử Hoa Kỳ – Wikipedia tiếng Việt,"Trong và sau chiến tranh, 13 tiểu quốc thống nhất thành một chính phủ liên bang 
yếu thông ... bản địa Mỹ (người da đỏ) nhằm chống những người định cư ở miền 
Tây nước Mỹ. .... Tân Hà Lan là thuộc địa Hà Lan vào thế kỷ 17 có trung tâm nằm 
trên khu vực ngày nay là .... Trong ý nghĩa này, đây là 'quốc gia mới' đầu tiên."".",13 vạch đỏ trên cờ Mỹ có ý nghĩa gì?
Biển báo giao thông tại Hoa Kỳ – Wikipedia tiếng Việt,"Bộ biển báo R6 của MUTCD là những biển báo đường một chiều và xa lộ có dãy 
phân cách. ... Những biển báo này được MUTCD quy định là chữ màu đỏ trên 
nền trắng, .... Bộ R13 của MUTCD là những biển báo liên quan đến trạm cân xe.",13 vạch đỏ trên cờ Mỹ có ý nghĩa gì?
Hổ – Wikipedia tiếng Việt,"Trong số các loại mèo lớn, chỉ có hổ và báo đốm Mỹ (jaguar) là bơi tốt, ... Hổ 
được liệt kê là loài có nguy cơ tuyệt chủng trong Sách đỏ IUCN kể từ năm 1986. 
.... được phân biệt dựa trên chiều dài lông và màu sắc, kiểu sọc và kích thước cơ 
thể, ...... hổ trưởng thành được cho ăn 3 đến 6 kg (6,6 đến 13,2 lb) thịt các loại 
như ...",13 vạch đỏ trên cờ Mỹ có ý nghĩa gì?
