MESSAGE,RESPONSE,GOOGLE
Minh Mạng – Wikipedia tiếng Việt,"Ông trị vì từ năm 1820 đến khi qua đời, được truy tôn miếu hiệu là Nguyễn Thánh 
.... Bấy giờ ông đã 30 tuổi nên rất am hiểu việc triều chính. ... Đối với vùng 
thượng du và các khu vực sinh sống của các dân tộc thiểu số, chủ ..... Tuy nhiên 
theo Nguyễn Văn Kiệm trong cuốn Triều Nguyễn và lịch sử của chúng ta đã đánh 
giá ...", Tuổi đời của chúng ta nên đo đếm bằng số năm ta sống hay bằng sự trưởng thành?
Hà Nội – Wikipedia tiếng Việt,"Tỉnh Hà Nội gồm có bốn phủ là Hoài Đức, Thường Tín, Ứng Hoà và Lý Nhân. .... 
Thành phố Hà Nội lúc này có diện tích nhỏ bao gồm 2 huyện Thọ Xương và 
huyện ..... tiếp giáp Hưng Yên rồi xuôi về Nam Định, thành phố có nhiều gắn kết 
với ...",Hà Nội tiếp giáp với bao nhiêu tỉnh?
Hòa Bình – Wikipedia tiếng Việt,"Trong quy hoạch xây dựng, tỉnh này thuộc vùng Hà Nội. ... Hòa Bình là tỉnh miền 
núi, tiếp giáp với phía tây đồng bằng sông Hồng, Hòa Bình ... 1 thành phố và 9 
huyện với 151 đơn vị hành chính cấp xã, bao gồm 10 thị trấn, 10 phường và 131 
xã. ... Tuy sống gần với người Mường lâu đời và đã bị ảnh hưởng nhiều về 
phong ...",Hà Nội tiếp giáp với bao nhiêu tỉnh?
Vùng thủ đô Hà Nội – Wikipedia tiếng Việt,"Vị trí Vùng thủ đô Hà Nội với Thành phố Hà Nội là đô thị trung tâm của vùng ... 
Vùng thủ đô Hà Nội bao gồm: Hà Nội, Vĩnh Phúc, Hưng Yên, Bắc Ninh, Hải 
Dương, Hà ... Phía nam giáp các tỉnh thuộc Vùng duyên hải Bắc Bộ và Thanh 
Hóa.",Hà Nội tiếp giáp với bao nhiêu tỉnh?
Hà Nam – Wikipedia tiếng Việt,"Hà Nam tiếp giáp phía bắc với thành phố Hà Nội, phía đông giáp với tỉnh Hưng 
Yên ... Kim Bảng) có địa hình đồi núi. phía đông là đồng bằng với nhiều điểm 
trũng. .... 1 thị xã và 4 huyện với 109 đơn vị hành chính cấp xã, bao gồm 6 thị trấn
, ...",Hà Nội tiếp giáp với bao nhiêu tỉnh?
Thái Nguyên – Wikipedia tiếng Việt,"Thái Nguyên nằm trong vùng kinh tế trọng điểm Bắc thủ đô Hà Nội, một trung ... 
Tỉnh Thái Nguyên có diện tích 3.562,82 km² phía bắc tiếp giáp với tỉnh Bắc Kạn, 
... có thung lũng Chợ Chu bao gồm nhiều cánh đồng và những thung lũng nhỏ.",Hà Nội tiếp giáp với bao nhiêu tỉnh?
Hưng Yên – Wikipedia tiếng Việt,"Trung tâm hành chính của tỉnh là thành phố Hưng Yên cách Thủ đô Hà Nội .... 
Tính đến ngày 1 tháng 4 năm 2019, toàn tỉnh có 5 tôn giáo khác nhau đạt 77.858 
người, nhiều nhất là Công giáo ..... Tỷ lệ người dân tham gia bảo hiểm y tế 90,5
%. .... Sông Giàn - Thuần Hưng là Đầu nguồn của Sông Cửu An tiếp giáp với 
Sông ...",Hà Nội tiếp giáp với bao nhiêu tỉnh?
"Đúng, huyện Mê Linh được sáp nhập vào Hà Nội hai lần - VnExpress","24 Tháng Mười 2017 ... Toàn bộ tỉnh Hà Tây, huyện Mê Linh (Vĩnh Phúc) và bốn xã thuộc huyện Lương 
Sơn (Hòa Bình) được chuyển ... Câu 5: Huyện nào của Hà Nội tiếp giáp với Thái 
Nguyên? ... Hà Nội có bao nhiêu phố bắt đầu bằng từ 'hàng'?",Hà Nội tiếp giáp với bao nhiêu tỉnh?
Bắc Giang – Wikipedia tiếng Việt,"Tỉnh lỵ là thành phố Bắc Giang, cách trung tâm thủ đô Hà Nội 50 km. ... Tại vùng 
núi phía đông bắc tỉnh, giáp với Quảng Ninh có khu rừng nguyên sinh Khe Rỗ ... 
nhiều nhất là Công giáo có 56.269 người, tiếp theo là Phật giáo có 4.607 người. 
... Năm 1891 sau khi trả hai huyện Bảo Lộc và Phượng Nhỡn cho tỉnh Bắc Ninh,
 ...",Hà Nội tiếp giáp với bao nhiêu tỉnh?
Bắc Ninh – Wikipedia tiếng Việt,"Bắc Ninh tiếp giáp với vùng trung du Bắc bộ tại tỉnh Bắc Giang. ... đây với trung 
tâm là chùa Dâu cùng nhiều nguồn di vật, tài liệu như tượng pháp, bia ký, ... Lộ 
Bắc Giang bao trùm Bắc Ninh và một phần Hà Nội, Bắc Giang ngày nay, gồm có 
3 ...",Hà Nội tiếp giáp với bao nhiêu tỉnh?
Gia Lâm – Wikipedia tiếng Việt,"Gia Lâm là một huyện ngoại thành phía đông của thành phố Hà Nội, Việt Nam. ... 
Có sông Hồng (làm ranh giới tiếp giáp với quận Hoàng Mai và huyện Thanh Trì), 
... Phía bắc giáp thị xã Từ Sơn, huyện Tiên Du, tỉnh Bắc Ninh và huyện Đông Anh 
... Huyện Gia Lâm có 22 đơn vị hành chính trực thuộc, bao gồm 2 thị trấn: Trâu ...",Hà Nội tiếp giáp với bao nhiêu tỉnh?
Cách mạng Công nghiệp – Wikipedia tiếng Việt,"Giai đoạn hai hay còn gọi là Cách mạng công nghiệp lần thứ hai tiếp tục ngay 
sau .... đoàn tàu buồm của Magellan hầu như không gặp một cơn bão đáng kể 
nào. ... một sự tiếp xúc giữa các nền văn hóa trên thế giới diễn ra do các cá nhân 
có ...",Nền công nghiệp nào đứng thứ hai thế giới?
Kinh tế Hàn Quốc – Wikipedia tiếng Việt,"Kinh tế Hàn Quốc là nền kinh tế tư bản chủ nghĩa phát triển, được xây dựng dựa 
... do cao, đứng thứ tư ở châu Á và xếp hạng 11 trên thế giới theo GDP năm 2018
. ... đầu người cao thứ hai trên thế giới, với GDP bình quân đầu người được ước 
... Hàn Quốc là nước có ngành công nghiệp đóng tàu lớn nhất trên thế giới với ...",Nền công nghiệp nào đứng thứ hai thế giới?
Kinh tế Trung Quốc – Wikipedia tiếng Việt,"Kinh tế Trung Quốc là nền kinh tế lớn thứ hai trên thế giới (sau Hoa Kỳ) nếu tính 
theo ... danh nghĩa và đứng thứ nhất nếu tính theo sức mua tương đương (PPP). 
.... Hậu quả là kinh tế suy thoái, nông nghiệp bị tàn phá, công nghiệp ngưng ..... 
cải cách (1979-1989) song không có thay đổi phương thức quản lý nào đáng kể.",Nền công nghiệp nào đứng thứ hai thế giới?
Thế giới thứ nhất – Wikipedia tiếng Việt,"Thuật ngữ ""Thế giới thứ nhất"" nói đến các nước dân chủ có nền kinh tế tư bản, ... 
Một số quốc gia quyết định đứng trung lập, không rơi vào bất kỳ một trong ba 
khối ... phần lớn lãnh thổ không nằm ở Tây Âu và không phải là nước công 
nghiệp.",Nền công nghiệp nào đứng thứ hai thế giới?
Đức – Wikipedia tiếng Việt,"Đức đứng hàng đầu thế giới trong một số lĩnh vực công nghiệp và công nghệ, 
...... khu rừng ngập nước, song gần đây số lượng của chúng lại phần nào có tăng
. ..... ba trên thế giới, và có nền kinh tế quốc dân lớn nhất tại châu Âu, đứng thứ tư
 ...",Nền công nghiệp nào đứng thứ hai thế giới?
Đế quốc Anh – Wikipedia tiếng Việt,"Vào đầu thể kỷ 19, cuộc Cách mạng công nghiệp bắt đẩu biến đổi nước Anh; ... 
Trong thời kỳ diễn ra cuộc chiến tranh thế giới thứ nhất, nước Anh đã phải dựa ... 
Trong Chiến tranh thế giới lần hai, các thuộc địa của Anh tại Đông Nam Á đã bị ... 
Nền móng của Đế quốc Anh bắt đầu được xây dựng từ khi Anh và Scotland ...",Nền công nghiệp nào đứng thứ hai thế giới?
Indonesia – Wikipedia tiếng Việt,"Indonesia là quốc gia có số dân theo Hồi giáo đông nhất thế giới; tuy nhiên khác 
... vu và là quốc gia có mức độ đa dạng sinh học đứng hàng thứ hai thế giới. ... 
nông nghiệp lý tưởng, và nền văn minh lúa nước xuất hiện sớm từ thế kỷ thứ VIII 
... Lãnh đạo quân đội, Tướng Suharto, công khai làm suy yếu vị trí chính trị của ...",Nền công nghiệp nào đứng thứ hai thế giới?
Kinh tế Hoa Kỳ – Wikipedia tiếng Việt,"Giá trị nguồn tài nguyên thiên nhiên đứng cao thứ hai thế giới, ước đạt 45 ... 
Nước Mỹ không chỉ có nền kinh tế lớn nhất, mà còn có sản lượng công nghiệp 
lớn nhất ...... giàu và người nghèo tại Mỹ lớn hơn bất cứ quốc gia phát triển nào 
khác.",Nền công nghiệp nào đứng thứ hai thế giới?
Nga – Wikipedia tiếng Việt,"Nga có nền kinh tế đứng thứ 12 theo GDP danh nghĩa năm 2016 hay lớn thứ 6 
theo ..... Trước năm 1991, kinh tế Liên Xô luôn là nền kinh tế lớn thứ hai thế giới, 
...... có thể đạt được một kết quả tích cực và đột phá nào trong ngành công 
nghiệp ...",Nền công nghiệp nào đứng thứ hai thế giới?
Công nghiệp hóa – Wikipedia tiếng Việt,"Một số nền kinh tế tiền công nghiệp, như Hy Lạp cổ đại, đã có các hoạt động trao 
... Nhiều nước thuộc Thế giới thứ ba bắt đầu các chương trình công nghiệp hóa 
... Hoa Kỳ là quốc gia có sản lượng công nghiệp đứng đầu thế giới năm 2005, ...",Nền công nghiệp nào đứng thứ hai thế giới?
Vụ ném bom nguyên tử xuống Hiroshima và Nagasaki – Wikipedia ...,"Trong Chiến tranh thế giới thứ hai, hai phe tham chiến đều theo đuổi chính sách 
ném ... Theo cơ quan Lịch sử chiến tranh Nhật Bản, các cuộc ném bom thành 
phố ... khoảng 60 thành phố của Nhật đã bị tàn phá trong chiến dịch ném bom ồ 
ạt. .... các nhà khoa học để quyết định xem nên thả bom nguyên tử xuống vị trí 
nào.","Trong thế chiến thứ hai, thành phố nào của Nhật Bản bị ném bom nguyên tử?"
Tội ác chiến tranh của Hoa Kỳ trong Chiến tranh thế giới thứ hai ...,"Tội ác của Hoa Kỳ trong thế chiến thứ hai bao gồm các hành động cướp bóc, 
đánh ... khí hủy diệt hàng loạt tại 2 thành phố lớn của Nhật Bản là Hiroshima và 
Nagasaki. ... Gần ngôi làng Pháp Audouville-la-Hubert, 30 tù nhân Wehrmacht 
của Đức bị ... Việc ném bom nguyên tử là do tổng thống Mỹ Harry S Truman phê 
duyệt.","Trong thế chiến thứ hai, thành phố nào của Nhật Bản bị ném bom nguyên tử?"
Trận Trân Châu Cảng – Wikipedia tiếng Việt,"Cuộc tấn công là một sự kiện lớn trong Chiến tranh thế giới thứ hai. ... chiến với 
Hoa Kỳ mà không bị thúc ép bởi bất kỳ cam kết nào với Nhật Bản đã lập ..... Hạm 
đội tàu ngầm số 6 do phó đô đốc Shimizu Mitsumi chỉ huy trong biên chế có: ..... 
quyết tử của truyền thống võ sĩ đạo, bước vào buồng lái chiếc máy bay ném bom
 ...","Trong thế chiến thứ hai, thành phố nào của Nhật Bản bị ném bom nguyên tử?"
Vũ khí hạt nhân – Wikipedia tiếng Việt,"Vũ khí hạt nhân (tiếng Anh: nuclear weapon), còn gọi là vũ khí nguyên tử, là loại 
vũ ... dùng trong Chiến tranh thế giới thứ hai: quả bom thứ nhất được ném xuống 
... công phá lớn khiến cho 1 hải đảo ở phía Bắc của Nga bị hủy diệt hoàn toàn. ... 
Nhưng cuối cùng thì 2 thành phố của Nhật Bản là Hiroshima và Nagasaki lại là ...","Trong thế chiến thứ hai, thành phố nào của Nhật Bản bị ném bom nguyên tử?"
Chiến tranh thế giới thứ hai – Wikipedia tiếng Việt,"Trong trận chiến trên đảo Okinawa, Nhật Bản bị tổn thất hơn ... Tuy nhiên di 
chứng của hai vụ ném bom nguyên tử thì cho ...","Trong thế chiến thứ hai, thành phố nào của Nhật Bản bị ném bom nguyên tử?"
Đế quốc Nhật Bản – Wikipedia tiếng Việt,"Sau một vài thắng lợi lớn trong Chiến tranh Trung-Nhật (1937-1945) và Chiến .... 
Trước Chiến tranh thế giới thứ hai, Nhật mở rộng vòng đai đế quốc, cai quản Đài 
.... Phần này của hiệp ước bị các nước lớn ở phương Tây bác bỏ, cảng được ..... 
bom nguyên tử thứ nhất đã được thả xuống thành phố Hiroshima, Nhật Bản.","Trong thế chiến thứ hai, thành phố nào của Nhật Bản bị ném bom nguyên tử?"
Khu tưởng niệm Hòa bình Hiroshima – Wikipedia tiếng Việt,"Quả bom gần như đã xóa sổ toàn bộ thành phố Hiroshima. ... lệnh tấn công ""ném 
bom đặc biệt"" vào các thành phố được lựa chọn ở Nhật Bản. ... Vào tháng 12 
năm 1996, Vòm bom nguyên tử đã được UNESCO công nhận là Di sản thế giới 
của ... gia chống lại Nhật Bản trong Chiến tranh thế giới thứ hai mới là những 
nước ...","Trong thế chiến thứ hai, thành phố nào của Nhật Bản bị ném bom nguyên tử?"
Hiroshima (thành phố) – Wikipedia tiếng Việt,"Thành phố Hiroshima (広島市, ひろしまし, Hiroshima-shi, Quảng Đảo thị) là thành 
phố, thủ phủ của tỉnh Hiroshima của Nhật Bản, là thành phố lớn nhất của Vùng ... 
sử vì Vụ ném bom nguyên tử tại Hiroshima và Nagasaki trong Thế chiến thứ hai. 
... Đây là một trong hai thành phố trên thế giới đã từng bị ném bom nguyên tử.","Trong thế chiến thứ hai, thành phố nào của Nhật Bản bị ném bom nguyên tử?"
Nhật Bản đầu hàng – Wikipedia tiếng Việt,"Sự đầu hàng của Đế quốc Nhật vào ngày 2 tháng 9 năm 1945 đã kết thúc chiến 
... Trong khi công khai tuyên bố sẽ chiến đấu cho đến khi kết thúc cay đắng, giới 
... Kỳ ném quả bom nguyên tử thứ hai, lần này là xuống thành phố Nagasaki. ... 
đã ký văn kiện Nhật Bản đầu hàng, theo đó kết thúcChiến tranh thế giới thứ hai.","Trong thế chiến thứ hai, thành phố nào của Nhật Bản bị ném bom nguyên tử?"
USS Indianapolis (CA-35) – Wikipedia tiếng Việt,"Hoạt động tác chiến đầu tiên của nó trong chiến tranh là tại Nam Thái Bình 
Dương, ... tàu chiến Mỹ bị tấn công bởi 18 máy bay ném bom hai động cơ chia 
thành hai đợt. ... Sau đó tàu ngầm Nhật Bản xuất hiện, nhưng lập tức bị các tàu 
khu trục Mỹ ... Indianapolis di chuyển đến Hawaii nơi nó trở thành soái hạm của 
Phó Đô ...","Trong thế chiến thứ hai, thành phố nào của Nhật Bản bị ném bom nguyên tử?"
Top phần mềm giải nén file và nén file tốt nhất hiện nay ...,"29 Tháng Mười 2018 ... Quản trị mạng sẽ giới thiệu cho bạn những phần mềm giải nén file và nén file ... 
Tuy nhiên lựa chọn phần mềm nào phù hợp nhất và tốt nhất trong số ... vì phải sử 
dụng công cụ file Explorer được tích hợp sẵn để chọn dữ liệu.",Phần mềm nào dùng để nén dữ liệu?
7-Zip – Wikipedia tiếng Việt,"7-Zip là phần mềm miễn phí, phát triển bởi Igor Pavlov và phân phối dưới giấy ... 
có thể tạo dạng lưu trữ 7z, với phần mở rộng .7z , dùng giải thuật LZMA để nén. 
... tiện dụng để sao lưu dữ liệu vào các thiết bị lưu trữ ngoài như CD và DVD.",Phần mềm nào dùng để nén dữ liệu?
Tập tin lưu trữ – Wikipedia tiếng Việt,"Tập tin lưu trữ được dùng để gom nhiều tệp dữ liệu thành một tệp duy nhất giúp 
... trữ, tệp nén còn thường được dùng trong đóng gói phần mềm để phân phối, ...",Phần mềm nào dùng để nén dữ liệu?
Những tính năng hay của WinRAR mà bạn chưa biết - Quantrimang ...,"13 Tháng Tám 2019 ... Đây là phần mềm được nhiều người sử dụng để giải nén cũng như nén các file 
dữ liệu trên máy tính, giúp việc quản lý hay chia sẻ dữ liệu đơn giản, nhanh 
chóng hơn thay vì ... Nén và giải nén file bằng WinRar như thế nào?",Phần mềm nào dùng để nén dữ liệu?
Nén dữ liệu – Wikipedia tiếng Việt,"... thông đường truyền. Tuy nhiên, vì dữ liệu nén cần được giải nén nên sẽ đòi 
hỏi nhiều phần cứng và xử lý. ... Chỉ các byte trùng lắp trong 1 file được loại trừ 
để giảm kích thước. Tùy dữ liệu nhưng ... Đây là một trong những chuẩn cổ nhất 
mà hiện nay vẫn sử dụng. MJPEG (Morgan ..... Phần mềm nén dữ liệu. Nén 
video ...",Phần mềm nào dùng để nén dữ liệu?
Top 20 phần mềm mã hóa tốt nhất cho Windows - Quantrimang.com,"22 Tháng Năm 2018 ... Với phần mềm này, bạn có thể nén file, sau đó bảo vệ chúng bằng mật ... Cách 
dùng Bitlocker để mã hóa dữ liệu trên Windows 10 (Phần 1) ...",Phần mềm nào dùng để nén dữ liệu?
Trung Quốc dùng chip nhỏ như hạt gạo để xâm nhập 30 công ty Mỹ,"5 Tháng Mười 2018 ... Startup này tạo ra chương trình phần mềm để nén các video lớn, với định dạng 
có thể ... Chip gián điệp được phát hiện thế nào ... Các máy chủ của Elemental 
được dùng tại các trung tâm dữ liệu của Bộ Quốc phòng Mỹ, hoạt ...",Phần mềm nào dùng để nén dữ liệu?
5 cách giảm dung lượng video cho iPhone - Quantrimang.com,"30 Tháng Sáu 2018 ... Thêm vào đó việc gửi file dung lượng lớn sẽ làm dữ liệu và băng thông di động 
của bạn hết một ... Sử dụng trang web trực tuyến để nén video.",Phần mềm nào dùng để nén dữ liệu?
Định dạng nén file nào tốt nhất? - Quantrimang.com,"10 Tháng 4 2019 ... Đã đến lúc nén một số tệp tin, vậy bạn sử dụng định dạng nào? Zip ... Bài viết 
này đã thử nghiệm một số bài kiểm tra để xác định định dạng nào cho phép nén 
tối đa. ... Giải nén file Zip, RAR,... trực tuyến không cần phần mềm ... nhau, vì vậy 
chúng là một bộ dữ liệu thực tế tốt chứa nhiều loại tệp khác nhau.",Phần mềm nào dùng để nén dữ liệu?
Ứng dụng giải nén file RAR tốt nhất trên Android - Quantrimang.com,"25 Tháng Sáu 2018 ... Định dạng RAR là một loại file phổ biến để nén dữ liệu. Mặc dù bạn có thể sử 
dụng file RAR trên macOS và Windows nhiều hơn trên điện thoại nhưng đôi khi 
bạn ... RAR hoạt động tốt với các file RAR nhiều phần và lưu trữ được mã hóa. ... 
WinZip có thể xử lý bất kỳ file RAR và ZIP nào một cách dễ dàng.",Phần mềm nào dùng để nén dữ liệu?
Hội chứng ống cổ tay – Wikipedia tiếng Việt,"Hội chứng này có những rối loạn gây đau ở cổ tay và bàn tay, tuy không gây tử 
vong ... Nhiều tác nhân tại chỗ và toàn thân có liên quan đến sự phát triển hội 
chứng ... chứng ống cổ tay không phải là một bệnh quá nghiêm trọng và thường 
giảm ... Và khi những cách điều trị đó không thật sự có tác dụng và đến khi bệnh 
tiến ...",Phương pháp giảm đau tại chỗ có tên là gì?
Ung thư – Wikipedia tiếng Việt,"Ung thư là một nhóm các bệnh liên quan đến việc phân chia tế bào một cách ... 
chảy máu bất thường, ho kéo dài, không giải thích được, giảm cân , và một .... 
Khối u là một khối mô bất thường, có thể ác tính, tức ung thư hoặc lành tính, ... 
Triệu chứng tại chỗ: các khối u bất thường hay phù nề, chảy máu (hemorrhage), 
đau ...",Phương pháp giảm đau tại chỗ có tên là gì?
Điều trị đau – Wikipedia tiếng Việt,"Điều trị đau bao gồm tất cả các phương pháp dùng thuốc và không dùng thuốc ... 
Các thuốc giảm đau có tác dụng giảm đau nhanh, mạnh và kéo dài, tuy ... Thuốc 
giảm đau không opioid: là những thuốc giảm đau ngoại biên. ... phong bế dẫn 
truyền (thuốc tê); Các phương pháp phong bế và tiêm tại chỗ ... Không gian tên.",Phương pháp giảm đau tại chỗ có tên là gì?
Paracetamol – Wikipedia tiếng Việt,"Paracetamol (tên nhãn hiệu quốc tế không độc quyền) hay acetaminophen, 
APAP (tên được chấp nhận tại Hoa Kỳ) là một thuốc có tác dụng hạ sốt và giảm 
đau, .... Từ nguyên liệu ban đầu là phenol, paracetamol có thể được tạo ra theo 
cách sau đây: .... Acetylcystein cũng được dùng tại chỗ để điều trị không có nước 
mắt.",Phương pháp giảm đau tại chỗ có tên là gì?
Thuốc giảm đau tại chỗ - Cẩn trọng khi dùng - Sức khỏe - ZING.VN,"4 Tháng Mười Hai 2015 ... Hoạt chất có tính chất giảm đau kháng viêm như methyl salicylate, ... Đặc biệt là 
trong thể thao hoặc tại các vị trí đau có nhiễm trùng như các ổ ...",Phương pháp giảm đau tại chỗ có tên là gì?
Nhiệt trị liệu – Wikipedia tiếng Việt,"Nhiệt trị liệu (tiếng Anh: thermotherapy) là một phương pháp điều trị của vật lý trị 
... giảm đau tăng cường dinh dưỡng và chuyển hóa tại chỗ, từ đó có tác dụng ...",Phương pháp giảm đau tại chỗ có tên là gì?
Những cách giảm đau tự nhiên không dùng thuốc,"24 Tháng Chín 2017 ... Tuy nhiên sử dụng quá nhiều thuốc giảm đau có thể dẫn đến tình ... Chườm 
nóng và lạnh là cách khắc phục cơn đau tại nhà phổ biến .... Hãy nhớ rằng, đau 
là dấu hiệu của cơ thể cảnh báo rằng có điều gì đó .... Theo Quang Thắng kể lại 
thì phải tới những năm 1990 thì tên tuổi của anh mới bắt đầu được .",Phương pháp giảm đau tại chỗ có tên là gì?
Ketoprofen – Wikipedia tiếng Việt,"Nó hoạt động bằng cách ức chế sản xuất tuyến tiền liệt của cơ thể. ... Miếng dán 
tại chỗ Ketoprofen đang được sử dụng để điều trị đau cơ xương khớp. ... và nó 
cũng có sẵn như là một miếng vá để giảm đau tại chỗ và hành động chống viêm. 
... ở Na Uy như Zon và Orudis; ở Nga với tên gọi là Pháp (Pháp), Fastum Gel và ...",Phương pháp giảm đau tại chỗ có tên là gì?
Hội chứng sợ không gian kín – Wikipedia tiếng Việt,"Hội chứng sợ không gian kín,có tên khoa học là Claustrophobia ,là nỗi sợ bị bao 
... xuất phát từ tiếng kêu lách cách của tiếng Latinh ""đóng cửa tại chỗ"" và tiếng Hy 
... đợi tại một cửa hàng, đơn giản vì những người mắc hội chứng này sợ bị giam 
... hội chứng sợ không gian kín gồm việc bắt đầu sợ hãi, nghẹt thở, tin rằng có ...",Phương pháp giảm đau tại chỗ có tên là gì?
Rối loạn ám ảnh cưỡng chế – Wikipedia tiếng Việt,"Bệnh còn có tên khác là rối loạn ám ảnh cưỡng bức. Người bị ảnh hưởng của 
bệnh có những ý nghĩ và hành vi lặp lại một cách vô nghĩa mà không kiểm soát ...",Phương pháp giảm đau tại chỗ có tên là gì?
Kiwi (chim) – Wikipedia tiếng Việt,"Kiwi là tên cho những loài chim không bay bản địa New Zealand, thuộc chi ... 
Những đặc điểm thích nghi riêng của kiwi là chân ngắn, mập mạp, trứng to, hay 
lỗ ...",Chim kiwi là loài chim đặc thù của nước nào?
Chim ở New Zealand – Wikipedia tiếng Việt,"Hệ động vật ở đây tồn tại nhiều loài chim đặc hữu độc đáo không có ở bất cứ ... 
vật có vú trên đất liền nào ngoài ba loài dơi, các loài chim New Zealand phát 
triển ... Chim kiwi, loài chim quốc gia của New Zealand, được đặt tên theo tiếng 
kêu ... Chim Kea là giống vẹt núi của New Zealand, là một loài có tính xã hội cao 
và ...",Chim kiwi là loài chim đặc thù của nước nào?
Chim kiwi và lá dương xỉ bạc là biểu tượng nước nào? - VnExpress,"19 Tháng Chín 2018 ... ... được gọi với tên thân mật là ""người kiwi"" theo tên loài chim đặc hữu. ... Nước 
nào lớn nhất châu Đại Dương? Cối xay gió là hình ảnh đặc trưng của nước nào? 
Quốc gia nào được mệnh danh là 'đất nước hình chiếc ủng'? ...",Chim kiwi là loài chim đặc thù của nước nào?
