MESSAGE,RESPONSE,GOOGLE
Đại dương – Wikipedia tiếng Việt,"Vì là thành phần chủ yếu của thủy quyển Trái Đất, đại dương thế giới không ... 
Khối chất lỏng bề mặt ngoài Trái Đất lớn và ổn định được xác nhận duy nhất là ...",Đại dương lớn nhất thế giới
"Đại dương nào lớn nhất thế giới, diện tích hơn 160 triệu km2? - Tư ...","25 Tháng 4 2019 ... Có diện tích hơn 160 triệu km2, đây chính là đại dương lớn nhất trên thế giới 
hiện nay.",Đại dương lớn nhất thế giới
Đại dương nào lớn nhất trên Trái Đất? - VnExpress,"20 Tháng Ba 2019 ... Một đại dương chiếm tới 1/3 tổng diện tích bề mặt địa cầu và sở hữu điểm sâu 
nhất của lớp vỏ Trái Đất. - VnExpress. ... Tòa tháp đôi cao nhất thế giới nằm ở 
đâu?",Đại dương lớn nhất thế giới
Thái Bình Dương – Wikipedia tiếng Việt,"Thái Bình Dương là đại dương lớn nhất địa cầu, nó trải dài từ Bắc Băng Dương 
... Magellan với chuyến hành trình vòng quanh thế giới của ông vào năm 1521.",Đại dương lớn nhất thế giới
"Đại dương nào lớn nhất hành tinh, diện tích hơn 165 triệu km2? - Tư ...","28 Tháng Chín 2018 ... Đây là một trong những khu ổ chuột lớn nhất thế giới, nằm trên đầm phá bên 
cạnh Đại Tây Dương, thuộc quốc gia đông dân nhất châu Phi.",Đại dương lớn nhất thế giới
Đại dương thế giới – Wikipedia tiếng Việt,"Sự thống nhất và liên tục của Đại dương Thế giới, với sự lưu thông vùng nước ... 
Ấn Độ Dương, lớn thứ ba, kéo dài về phía bắc từ Nam Đại Dương đến Ấn Độ, ...",Đại dương lớn nhất thế giới
Chủ đề:Địa lý – Wikipedia tiếng Việt,"Trên thế giới có 6 châu và 5 đại dương: ... Núi lửa lớn nhất thế giới: Núi Mauna 
Loa ở Hawaii chiếm danh hiệu này trên Trái đất. Nó cao 15,2 km tính từ chân núi
 ...",Đại dương lớn nhất thế giới
Châu Đại Dương – Wikipedia tiếng Việt,"Úc là quốc gia lớn nhất và đông dân nhất tại châu Đại Dương, còn Sydney của 
..... Melanesia nằm về phía tây nam, gồm đảo New Guinea lớn thứ nhì thế giới, ...",Đại dương lớn nhất thế giới
Đại Tây Dương – Wikipedia tiếng Việt,"Đại Tây Dương trên bản đồ thế giới ... Rãnh Puerto Rico, ở Bắc Đại Tây Dương, 
là rãnh có độ sâu lớn nhất 8.605 mét (4.705 sải; 28.232 ft); Laurentian Abyss ...",Đại dương lớn nhất thế giới
Biển – Wikipedia tiếng Việt,"Biển nói chung là một vùng nước mặn rộng lớn nối liền với các đại dương, hoặc 
là các hồ ... Các ion phong phú nhất trong nước biển là clo và natri. .... phần 
tương đối của các muối hòa tan là ổn định trong khắp các đại dương của thế giới
.",Đại dương lớn nhất thế giới
10 quốc gia có diện tích nhỏ nhất thế giới - Giáo dục - ZING.VN,"23 Tháng Sáu 2019 ... 10 quốc gia có diện tích nhỏ nhất thế giới. Nguyễn Thanh Điệp; 06:00 ... Bạn biết 
gì về đất nước và con người nơi đây? Nguyễn Thanh Điệp.",Quốc gia nào nhỏ nhất thế giới về diện tích?
Top 10 quốc gia có diện tích nhỏ nhất trên thế giới - Quantrimang.com,"Dưới đây là top 10 quốc gia có diện tích nhỏ nhất nhưng đừng để bị đánh lừa ... 
quốc gia nào lớn nhất, dài nhất, thấp nhất hay sang trọng nhất trên thế giới và ... 
đầu thế giới về chi nhục đậu khấu (nutmeg - một loài cây gia vị ở Indonesia) và ...",Quốc gia nào nhỏ nhất thế giới về diện tích?
Quốc gia nào nhỏ nhất thế giới? - VnExpress,"23 Tháng Tám 2018 ... Nước châu Âu chỉ rộng 0,44 km2 với dân số hơn 800 và không áp bất kỳ khoản 
thuế nào đối với mọi hoạt động liên quan đến kinh tế.",Quốc gia nào nhỏ nhất thế giới về diện tích?
"Đúng, Vatican là quốc gia nhỏ nhất thế giới - VnExpress","23 Tháng Tám 2018 ... Vatican là quốc gia độc lập có diện tích nhỏ nhất thế giới đồng thời cũng là nước 
có dân ... Tên nước nào trùng với từ 'gà tây' trong tiếng Anh?",Quốc gia nào nhỏ nhất thế giới về diện tích?
Thành Vatican – Wikipedia tiếng Việt,"Trong khi ""Vatican"" là thuật ngữ thường để chỉ về lãnh thổ của một quốc gia với 
vài ..... Thành Quốc Vatican là quốc gia nhỏ nhất trên thế giới với diện tích 
khoảng .... của Đức Giáo hoàng, cũng như có thể bị cách chức bởi Ngài bất kì lúc 
nào.",Quốc gia nào nhỏ nhất thế giới về diện tích?
10 quốc gia nhỏ nhất thế giới,"4 Tháng 4 2013 ... Đây là quốc gia độc lập nhỏ nhất thế giới, diện tích chỉ có khoảng 0,5 ... phủ là từ 
bán tem và các đồng tiền xưa, ngoại tệ của công nhân gửi về.",Quốc gia nào nhỏ nhất thế giới về diện tích?
"Quốc gia nào nhỏ nhất thế giới, dân số chưa đến 1.000 người? - Tư ...","6 Tháng Chín 2018 ... Đây là quốc gia được công nhận có diện tích nhỏ nhất thế giới, chỉ khoảng 44 ha
, dân số chưa đến 1.000 người.",Quốc gia nào nhỏ nhất thế giới về diện tích?
Quốc gia nào nhỏ nhất thế giới? - Du lịch - ZING.VN,"26 Tháng Tám 2018 ... Bên trong 'khách sạn bay' lớn nhất thế giới Airlander là một ""khách sạn bay"" thực 
thụ với nội thất sang trọng, kết hợp giữa khinh khí cầu, máy ...",Quốc gia nào nhỏ nhất thế giới về diện tích?
Danh sách quốc gia theo diện tích – Wikipedia tiếng Việt,"Đây là một danh sách những quốc gia trên thế giới xếp hạng theo tổng diện tích. 
... Tổng các diện tích gồm, ví dụ đất và các vùng mặt nước trong nội địa (hồ, ..... 
thuộc Anh; gồm Alderney, Guernsey, Herm, Sark và một số đảo nhỏ khác .... 
Bảng thống kê công bố về diện tích của các quốc gia và vùng lãnh thổ trên thế 
giới ...",Quốc gia nào nhỏ nhất thế giới về diện tích?
Châu Đại Dương – Wikipedia tiếng Việt,"Châu Đại Dương là lục địa nhỏ nhất về diện tích đất liền và nhỏ thứ nhì về dân 
số ... quốc gia châu Đại Dương có thể chế chính trị đa đảng dân chủ đại diện 
nghị viện, .... tích rõ ràng về sự bành trướng này, cho phép xác định chính xác 
phần nào .... Melanesia nằm về phía tây nam, gồm đảo New Guinea lớn thứ nhì 
thế giới, ...",Quốc gia nào nhỏ nhất thế giới về diện tích?
Roma – Wikipedia tiếng Việt,"Đây là thành phố đông dân thứ tư của Liên minh châu Âu, sau Luân Đôn, Berlin 
và ... Roma ban đầu được gọi là Thành phố vĩnh hằng (tiếng Latinh: Urbs ...... 
nào về tổ chức của thành phố cho đến năm 1870, khi Roma trở thành thủ đô của 
..... Quy mô thành phố vào thời Hoàng đế Augustus là vấn đề cần nghiên cứu, 
các ...",Thành phố châu Âu nào được gọi là thành phố vĩnh cửu?
Vì sao Rome được gọi là “Thành phố vĩnh cửu“? - KhoaHoc.tv,"6 Tháng 4 2018 ... ... đến thế kỷ thứ 7, Rome trở thành trung tâm quyền lực ở châu Âu. Thành phố 
Rome Cho tới ngày nay, Rome vẫn là một trong những thủ đô lâu đời nhất của 
thế giới. ... Đặc biệt, Rome được biết đến với tên gọi ""Thành phố vĩnh cửu"" vì ... 
điều gì xảy ra với thế giới thì Rome vẫn sẽ trường tồn với thời gian.",Thành phố châu Âu nào được gọi là thành phố vĩnh cửu?
Đế quốc Ottoman – Wikipedia tiếng Việt,"Tên gọi Ottoman có nguồn gốc từ Osman I (còn gọi là Osman Bey) (tiếng Ả Rập: 
... Thành phố này trở thành kinh đô mới của Đế quốc Ottoman, và Mehmed II ... 
nào ở châu Âu ngoại trừ Pháp. Gần 30 quốc gia hiện nay đã được thành lập từ 
..... Ông lên làm Sultan Mahmud II (1808 - 1839) và giết chết cựu hoàng Mustafa 
IV.",Thành phố châu Âu nào được gọi là thành phố vĩnh cửu?
Cần Thơ – Wikipedia tiếng Việt,"Cần Thơ là một thành phố trực thuộc trung ương của Việt Nam, là thành phố hiện 
đại và phát triển nhất ở Đồng bằng sông Cửu Long. ... Năm 1739, vùng đất Cần 
Thơ được khai phá và chính thức có mặt trên dư đồ Việt Nam với tên gọi là Trấn 
... Phía bắc giáp tỉnh An Giang, phía đông giáp tỉnh Đồng Tháp và tỉnh Vĩnh ...",Thành phố châu Âu nào được gọi là thành phố vĩnh cửu?
Thành viên:Michel Djerzinski/Nháp biểu quyết 2 – Wikipedia tiếng Việt,"Khi viết bài về Sơ kỳ Trung Đại châu Âu, tôi thấy rằng trong các bài viết về thời kì 
... Trong thời kỳ mơ hồ tạm gọi ở đây ""cổ đại"", hiện tại trên Wikipedia còn tồn tại ... 
Thành phố được mệnh danh là Thành phố Vĩnh cửu đã tồn tại như một thực ... 
thành phố diễn ra liền mạch không đứt đoạn, không thể lấy mốc nào để chia ra.",Thành phố châu Âu nào được gọi là thành phố vĩnh cửu?
Vĩnh Long – Wikipedia tiếng Việt,"Vĩnh Long là một tỉnh nằm ở khu vực đồng bằng sông Cửu Long, Việt Nam. Vĩnh 
Long cách Thành phố Hồ Chí Minh 135 km về phía Nam và cách Thành phố ... ấy 
được Nguyễn Phúc Chú thành lập, với tên gọi đầu tiên của tỉnh là Châu Định ...",Thành phố châu Âu nào được gọi là thành phố vĩnh cửu?
Giáo hội Công giáo Rôma – Wikipedia tiếng Việt,"Cơ quan trung ương giáo huấn thường được gọi là ""Tòa Thánh"" (Sancta ... là các 
vị lãnh đạo trong Giáo triều Rôma, các Giám mục của các thành phố lớn và các 
..... sự cứu rỗi để hướng tới một cuộc sống vĩnh hằng và ngài coi đó như là một 
..... là phong cách kiến trúc Roman, Gothic trong các đại giáo đường ở châu Âu.",Thành phố châu Âu nào được gọi là thành phố vĩnh cửu?
Hại não với 10 câu hỏi thử tài thách trí - VnExpress,13 Tháng Mười Một 2015 ... Thành phố châu Âu nào được gọi là thành phố vĩnh cửu? - VnExpress.,Thành phố châu Âu nào được gọi là thành phố vĩnh cửu?
Thị Nở - Trang 4 - VnExpress,"Thị Nở - Thành phố châu Âu nào được gọi là thành phố vĩnh cửu? - Hại não với 
10 câu hỏi thử tài thách trí.",Thành phố châu Âu nào được gọi là thành phố vĩnh cửu?
Sông Cổ Chiên – Wikipedia tiếng Việt,"Sông bắt đầu từ thành phố Vĩnh Long, chảy theo hướng tây bắc-đông nam, ... 
Trong đó, Cochin có nguồn gốc từ tên gọi sông Koh Chin (កោះជីន), là một ... 
Các nhà thám hiểm hàng hải châu Âu vào thế kỷ XV khi đến vùng đất đồng bằng 
sông Cửu ... Tên gọi Cochinchine này sang đầu thế kỷ XVII có lúc đã được người
 ...",Thành phố châu Âu nào được gọi là thành phố vĩnh cửu?
Corse – Wikipedia tiếng Việt,"Mặc dù đảo Corse bị tách khỏi đại lục Pháp qua biển Ligurienne và gần với Ý 
hơn ... Sau một thời gian ngắn bị người Carthage chiếm đóng, bị người Hy Lạp 
cổ đại thuộc địa hóa, và bị ... Mặc dù gây nên cuộc khủng hoảng Corse tại 
Vương quốc Anh, song người Corse đã không nhận được hỗ trợ quân sự ngoại 
quốc nào.",Đảo Korsika(Cooc) thuộc nước nào
Quần đảo Cook – Wikipedia tiếng Việt,"Quần đảo Cook (Tiếng Māori quần đảo Cook: Kūki 'Āirani) là một nền dân chủ 
nghị .... Đất nước này vẫn là một lãnh thổ phụ thuộc của New Zealand cho đến 
năm .... tiết lộ tên là bất hợp pháp hoặc bất kỳ thông tin nào về tín thác của Cooks
).",Đảo Korsika(Cooc) thuộc nước nào
10 Vạn Câu Hỏi Vì Sao - Phần 1,"-Nó chia bán đảo Triều tiên năm 1945 thành Bắc Triều tiên và Hàn quốc. •Đảo 
Korsika(Cooc) thuộc nước nào? -Thuộc Pháp, đây là quê hương của Napoleon,
 ...",Đảo Korsika(Cooc) thuộc nước nào
10 vạn câu hỏi vì sao,"-Nó chia bán đảo Triều tiên năm 1945 thành Bắc Triều tiên và Hàn quốc. •Đảo 
Korsika(Cooc) thuộc nước nào? -Thuộc Pháp, đây là quê hương của Napoleon,
 ...",Đảo Korsika(Cooc) thuộc nước nào
Hành trình đến đảo Corse lộng lẫy - VnExpress,"28 Tháng Sáu 2013 ... Đảo Corse nằm trên biển Địa Trung Hải, thuộc miền Đông Nam nước Pháp. Với 
diện tích chỉ có 8.722 km2, đảo Corse có tới hơn 1.000 km bờ ...",Đảo Korsika(Cooc) thuộc nước nào
Vương quốc Corse (1794-1796) – Wikipedia tiếng Việt,"Vương quốc Corse là một quốc gia độc lập trên đảo Corse tồn tại vào giữa 
những ... bố Corse ly khai khỏi nước Pháp. Ông yêu cầu sự bảo vệ của chính 
phủ Anh, ... một vương quốc tự trị trực thuộc nền quân chủ Anh. Về phía Anh 
quốc cho đó là ... vì không có sự thay thế nào khác, ông buộc phải tham gia cùng 
người Anh ...",Đảo Korsika(Cooc) thuộc nước nào
Cộng hòa Corse – Wikipedia tiếng Việt,"Cộng hòa Corse là một quốc gia có chủ quyền trên đảo Corse được Pasquale ... 
nhận là họ cũng đã bỏ phiếu trong các cuộc bầu cử quốc gia dưới thời kỳ Cộng 
hòa. Nước cộng hòa còn đúc tiền xu của riêng mình tại Murato vào năm 1761, ... 
Cho đến ngày nay, một số người thuộc thành phần ly khai Corse chẳng hạn như
 ...",Đảo Korsika(Cooc) thuộc nước nào
Ý chiếm đóng Corse – Wikipedia tiếng Việt,"Sự chiếm đóng đảo Corse của Ý được sự ủng hộ mạnh mẽ từ phong trào ... đã 
nắm quyền kiểm soát đảo Corse, khi đó vẫn đang thuộc chủ quyền chính phủ ... 
ban đầu không có đơn vị Corse kháng chiến nào được lập dưới sự chiếm đóng 
của Ý ... và thực hiện những biện pháp đề phòng cuộc đổ bộ của quân Đồng 
Minh.",Đảo Korsika(Cooc) thuộc nước nào
Cảng Thượng Hải – Wikipedia tiếng Việt,"Cảng Thượng Hải nhìn ra biển Hoa Đông về phía đông, và vịnh Hàng Châu ở ... 
và cảng Quảng Châu để trở thành cảng lớn nhất của Trung Quốc vào lúc đó.",Cảng nào lớn nhất Đông Á?
Singapore – Wikipedia tiếng Việt,"Lãnh thổ của Singapore liên tục mở rộng thông qua hoạt động cải tạo đất. ... 
phồn thịnh nhất tại khu vực Đông Nam Á, sánh ngang với các thành phố cảng 
lớn .... tàu đỗ không biết cơ man nào mà kể, tàu của khắp các nước đi tự Á Đông 
sang ...",Cảng nào lớn nhất Đông Á?
Sân bay quốc tế Incheon – Wikipedia tiếng Việt,"Đây là một trong những cảng trung chuyển hàng không lớn nhất và nhộn nhịp 
nhất trên thế giới, là cửa ngõ quan trọng vào Đông Á và cả châu Á. Sân bay này
 ...",Cảng nào lớn nhất Đông Á?
Busan – Wikipedia tiếng Việt,"... cảng lớn nhất của Hàn Quốc, nằm ở phía đông nam của bán đảo Triều Tiên. ... 
Trên diện trường quốc tế, Busan là địa điểm tổ chức Đại hội Thể thao châu Á ...",Cảng nào lớn nhất Đông Á?
Sân bay quốc tế Long Thành – Wikipedia tiếng Việt,"Vị trí sân bay Tân Sơn Nhất nằm trong khu vực nội đô vốn đông đúc và chật chội, 
... các cảng hàng không trung chuyển lớn khác trong khu vực Đông Nam Á nói ...",Cảng nào lớn nhất Đông Á?
Giao thông Hải Phòng – Wikipedia tiếng Việt,"Hệ thống giao thông của Hải Phòng đóng vai trò quan trọng trong việc vận tải ... 
mối quan hệ gắn bó với nhiều cảng lớn ở Đông Nam Á, châu Á, châu Đại Dương
, ... cùng với Cảng Sài Gòn là một trong 2 hệ thống cảng biển lớn nhất Việt Nam,
 ...",Cảng nào lớn nhất Đông Á?
Dammam – Wikipedia tiếng Việt,"Dammam (tiếng Ả Rập: الدمام‎ ad-Dammām) là thủ phủ của vùng Đông thuộc Ả ... 
Giống như các thủ phủ vùng khác, Dammam không thuộc tỉnh nào mà thuộc ... 
Hải cảng Quốc vương Abdul Aziz của Dammam là cảng lớn nhất trên vịnh Ba Tư,
 ...",Cảng nào lớn nhất Đông Á?
Hải Phòng – Wikipedia tiếng Việt,"Cát Bà cũng là đảo lớn nhất thuộc khu vực Vịnh Hạ Long. ...... mối quan hệ gắn 
bó với nhiều cảng lớn ở Đông Nam Á, châu Á, châu Đại Dương, Bắc Mỹ, ...... một 
ai có thể lấy đi ở đây bất cứ thứ gì dù đó chỉ là một hòn đá, hay một chiếc lá cây.",Cảng nào lớn nhất Đông Á?
Sân bay quốc tế Nội Bài – Wikipedia tiếng Việt,"Sân bay Nội Bài là trung tâm hoạt động chính cho Vietnam Airlines, VietJet Air, ... 
Sân bay do Tổng công ty cảng hàng không Việt Nam (ACV), một cơ quan của ... 
A thông qua một hành lang kín kéo dài, giúp giảm tải phần nào cho sân bay. ... 
trở thành một trong những trạm trung chuyển hàng không lớn nhất Đông Nam Á.",Cảng nào lớn nhất Đông Á?
Sân bay quốc tế Tân Sơn Nhất – Wikipedia tiếng Việt,"Tên giao dịch chính thức: Cảng hàng không quốc tế Tân Sơn Nhất. Sân bay này 
.... Lúc 3h sáng ngày 27 tháng 10 năm 2008, nhà ga nội địa đã cháy lớn. ..... cơ 
sở điều hành bay được trang bị hiện đại nhất của Việt Nam và Đông Nam Á.",Cảng nào lớn nhất Đông Á?
Ngũ Đại Hồ – Wikipedia tiếng Việt,"Đôi khi năm hồ này được gọi biển nội địa. Các hồ lớn[sửa | sửa mã nguồn]. Hồ 
Superior, hồ lớn và sâu nhất, lớn hơn Cộng hòa Séc ... Michigan, Erie và 
Superior, nhưng cách này không có thứ tự đặc biệt nào. ... Ngày nay, 20% dung 
tích nước ngọt trên thế giới nằm trong nhóm hồ này: gần 23.000 km³ (5.473 dặm 
khối).",Hồ nội địa nào sâu nhất thế giới?
Sông nào dài nhất thế giới? - VnExpress,"12 Tháng Mười Một 2019 ... Một phần dòng sông dài nhất thế giới. Ảnh: National ... Hồ nước nào lớn nhất thế 
giới? Tin nổi bật. Thế giới bước sang năm mới 2020 ...",Hồ nội địa nào sâu nhất thế giới?
Hồ Baikal – Wikipedia tiếng Việt,"... hồ Baikal có diện tích bề mặt lớn hơn bất kỳ hồ nước ngọt nào khác tại châu Á 
và là hồ sâu lớn nhất thế giới với độ sâu ...",Hồ nội địa nào sâu nhất thế giới?
Biển Chết – Wikipedia tiếng Việt,"Biển Chết dài 76 km, chỗ rộng nhất tới 18 km và chỗ sâu nhất là 400 m. ... và các 
du khách từ các khu vực xung quanh Địa Trung Hải trong hàng nghìn năm qua. 
... nghỉ ngơi đầu tiên trên thế giới của Herod Đại Đế, và là nguồn cung cấp các 
sản phẩm ... Đối với người Hy Lạp thì biển Chết là ""hồ Asphaltites"" (xem dưới 
đây).",Hồ nội địa nào sâu nhất thế giới?
"Sai, sông Amazon rộng nhất - VnExpress","12 Tháng Mười Một 2019 ... ... và Peru) rộng nhất thế giới. Vào mùa khô, nơi rộng nhất của Amazon là 11 km. 
... Câu 3: Sông nào sâu nhất thế giới? a. Amazon · b. Congo.",Hồ nội địa nào sâu nhất thế giới?
"Đúng, sông Amazon rộng nhất - VnExpress","12 Tháng Mười Một 2019 ... ... và Peru) rộng nhất thế giới. Vào mùa khô, nơi rộng nhất của Amazon là 11 km. 
... Câu 3: Sông nào sâu nhất thế giới? a. Amazon · b. Congo.",Hồ nội địa nào sâu nhất thế giới?
Biển Caspi – Wikipedia tiếng Việt,"Biển Caspi (cũng được phiên âm là: Caxpi, Hán Việt: Lý Hải 裏海) là hồ nước lớn 
nhất trên thế giới tính về cả diện tích và thể tích. Diện tích mặt nước là 371.000 ...",Hồ nội địa nào sâu nhất thế giới?
"Đúng, Congo là sông sâu nhất - VnExpress","12 Tháng Mười Một 2019 ... Điểm sâu nhất xấp xỉ 220 m, nhỉnh hơn 20 m so với con sông xếp thứ hai là 
Trường Giang (Trung ... Câu 4: Dòng sông nào nóng nhất thế giới?",Hồ nội địa nào sâu nhất thế giới?
Biển – Wikipedia tiếng Việt,"Các ion phong phú nhất trong nước biển là clo và natri. ..... lịch sử địa chất của 
Trái Đất, làm thể hiện một điều không rõ rằng như thế nào ..... Dòng hải lưu sâu 
chảy qua tất cả các đại dương trên thế giới và được gọi là vòng .... Biển Aral ở 
Trung Á và Hồ Pyramid ở miền Tây Hoa Kỳ là ví dụ về các vực nước mặn nội địa 
mà ...",Hồ nội địa nào sâu nhất thế giới?
Biển Đen – Wikipedia tiếng Việt,"Biển Đen hay Hắc Hải là một biển nội địa nằm giữa Đông Nam châu Âu và ... cho 
rằng Biển Đen đã từng là một hồ nước ngọt trong đất liền (ít nhất là trong các lớp 
... bồn nước phân tầng lớn nhất trên thế giới, ở đó các lớp nước ở dưới sâu và ...",Hồ nội địa nào sâu nhất thế giới?
Saint Helena – Wikipedia tiếng Việt,"Flag of Saint Helena.svg · Shield of Saint Helena.svg ... đặt theo tên của Helena 
thành Constantinopolis, là đảo núi lửa nằm ở phía Nam Đại Tây ... Ngôi nhà 
Longwood chính là nơi sinh sống của ông và Sane Valley trên đảo sau thất bại ... 
Ngày nay, Saint Helena là một thành viên của Hiệp hội Thể thao Các đảo Thế 
giới ...",Đảo St. Helenanằm ở đâu?
Đảo Ascension – Wikipedia tiếng Việt,"Đảo là nơi đặt RAF Ascension Island (một sân bay trong những trạm Không lực 
... Đảo Ascension có một trong bốn anten (ba anten còn lại ở đảo Kwajalein, ...",Đảo St. Helenanằm ở đâu?
Nhịp sống trên hòn đảo mà hoàng đế Napoleon qua đời - Khám phá ...,"30 Tháng Mười 2014 ... Saint Helena là một hòn đảo thuộc Anh ở phía Nam Đại Tây Dương, ... đảo là 
điểm thu hút khách du lịch nhưng rất ít người sẵn sàng bỏ ra 6 ...",Đảo St. Helenanằm ở đâu?
'Sân bay vô dụng nhất thế giới' hết vô dụng - VnExpress Du lịch,"17 Tháng Mười 2017 ... Sân bay St. Helena nằm trên quần đảo xa xôi cùng tên ở phía nam Đại Tây 
Dương, thuộc lãnh thổ hải ngoại Anh. Tháng 5/2016, hoàng tử ...",Đảo St. Helenanằm ở đâu?
'Sân bay vô dụng nhất thế giới' đón chuyến bay đầu tiên - Du lịch ...,"8 Tháng Năm 2017 ... Tiêu tốn 250 triệu bảng, sân bay St Helena “đắp chiếu” sau hơn một năm khai ... 
hành khách đã hạ cánh xuống sân bay St Helena nằm giữa Đại Tây dương, ... 
Danh xưng đã gắn liền với sân bay đảo St Helena trong suốt hơn một ... Tắm 
onsen là một trải nghiệm hấp dẫn du khách ở Nhật Bản dù có nhiều ...",Đảo St. Helenanằm ở đâu?
'Sân bay vô dụng nhất thế giới' đã bớt vô dụng - Thế giới - Zing.vn,"15 Tháng Mười 2017 ... Chuyến bay kéo dài 6 giờ 15 phút, tính cả thời gian quá cảnh ở thủ đô ... Đảo St. 
Helena nằm giữa châu Phi và Nam Mỹ, có diện tích 122 km2 ...",Đảo St. Helenanằm ở đâu?
Doubtful Sound – Wikipedia tiếng Việt,"Doubtful Sound là một trong những vịnh hẹp sâu và đẹp nhất nằm ở phía ... số 
hòn đảo nhỏ và địa điểm trong vịnh như: Febrero, Bauza, the Nee Islets, ... Vịnh 
bao gồm nhiều thác nước lớn, đặc biệt là thác Helena (nằm ở điểm đầu ... Các 
loài này bao gồm san hô đen (Antipatharia fiordensis) thường được tìm thấy ở độ
 ...",Đảo St. Helenanằm ở đâu?
10 vạn câu hỏi vì sao,"•Đảo St. Helenanằm ở đâu? -Nằm giữa Đại tây dương , khoảng 3000 kmcách bờ 
biển phía tây của. Angola. Napoleon bị đẩy và chết ở đây. • Người ta gọi vùng ...",Đảo St. Helenanằm ở đâu?
